web-scraper-order,web-scraper-start-url,halaman_pencarian,judul,excerpt,author,link_pencarian,link_pencarian-href
"1700584830-138","https://scholar.google.com/scholar?hl=en&as_sdt=0%2C5&as_ylo=2023&as_yhi=2023&q=kecerdasan+buatan+untuk+deteksi+penyakit+hewan&btnG=","https://scholar.google.com/scholar?start=204&q=kecerdasan+buatan+untuk+deteksi+penyakit+hewan&hl=en&as_sdt=0,5&as_ylo=2023&as_yhi=2023","Pemilihan Alternatif Konservasi Energi Listrik Di Politeknik Negeri Pontianak Menggunakan Metode Fuzzy Logic","… komoditas tanaman pangan, hewan ternak, dan ikan Kajian … berbahaya dalam produk asal 

tanaman dan hewan/ikan … fuzzy logic ataupun metode kecerdasan buatan lainnya. Untuk …","M Syamsudin, W Yuniarto, Y Yunita, K Kuspriyanto… - 2023 - repository.polnep.ac.id","[PDF] polnep.ac.id","http://repository.polnep.ac.id/xmlui/bitstream/handle/123456789/2245/Laporan_PKPT_Tahun-1.pdf?sequence=1"
"1700584830-139","https://scholar.google.com/scholar?hl=en&as_sdt=0%2C5&as_ylo=2023&as_yhi=2023&q=kecerdasan+buatan+untuk+deteksi+penyakit+hewan&btnG=","https://scholar.google.com/scholar?start=204&q=kecerdasan+buatan+untuk+deteksi+penyakit+hewan&hl=en&as_sdt=0,5&as_ylo=2023&as_yhi=2023","Pengukuran Dan Penilaian Tumbuh Kembang Anak Usia Dini","… adanya gejala-gejala hambatan intelektual. Misalnya, untuk mengukur kecerdasan anak 

dengan menggunakan tes kecerdasan, sehingga dapat ditentukan tingkat kecerdasan anak …","J Dimyati - 2023 - books.google.com","Pengukuran Dan Penilaian Tumbuh Kembang Anak Usia Dini","https://books.google.com/books?hl=en&lr=&id=VDbZEAAAQBAJ&oi=fnd&pg=PP1&dq=kecerdasan+buatan+untuk+deteksi+penyakit+hewan&ots=UvOmcdk9t4&sig=8kyPTBGMzsSTkrrzWkbV0umTos8"
"1700584830-140","https://scholar.google.com/scholar?hl=en&as_sdt=0%2C5&as_ylo=2023&as_yhi=2023&q=kecerdasan+buatan+untuk+deteksi+penyakit+hewan&btnG=","https://scholar.google.com/scholar?start=204&q=kecerdasan+buatan+untuk+deteksi+penyakit+hewan&hl=en&as_sdt=0,5&as_ylo=2023&as_yhi=2023","Faktor Pendorong Kebijakan Lockdown Kerajaan Arab Saudi Sebelum Deklarasi Pandemi Oleh World Health Organization Pada Tahun 2020","… Grosir Huanan adalah pasar hewan dan makanan laut hidup. Karakter penyakit tersebut 

terbilang baru dan belum diketahui darimana asalnya. Pada awal kemunculannya, virus ini …","KI Muslimah - repository.uinjkt.ac.id","[PDF] uinjkt.ac.id","https://repository.uinjkt.ac.id/dspace/bitstream/123456789/74104/1/KAMILAH%20INSAN%20MUSLIMAH.FISIP.pdf"
"1700584830-141","https://scholar.google.com/scholar?hl=en&as_sdt=0%2C5&as_ylo=2023&as_yhi=2023&q=kecerdasan+buatan+untuk+deteksi+penyakit+hewan&btnG=","https://scholar.google.com/scholar?start=204&q=kecerdasan+buatan+untuk+deteksi+penyakit+hewan&hl=en&as_sdt=0,5&as_ylo=2023&as_yhi=2023","Sistem kontrol gas amonia (nh3) kandang ayam dengan metode fuzzy logic berbasis internet of things iot","… nafsu makan hewan, mengurangi … Gejala yang ditimbulkan akibat terpapar dengan 

amonia tergantung pada jalan terpaparnya, dosis, dan lama pemaparannya. Gejala-gejala …","K Supriadi - repository.uinjkt.ac.id","[PDF] uinjkt.ac.id","https://repository.uinjkt.ac.id/dspace/bitstream/123456789/68026/1/KHASBIANTA%20SUPRIADI-FST.pdf"
"1700584830-142","https://scholar.google.com/scholar?hl=en&as_sdt=0%2C5&as_ylo=2023&as_yhi=2023&q=kecerdasan+buatan+untuk+deteksi+penyakit+hewan&btnG=","https://scholar.google.com/scholar?start=204&q=kecerdasan+buatan+untuk+deteksi+penyakit+hewan&hl=en&as_sdt=0,5&as_ylo=2023&as_yhi=2023","","","A Wibisono - 2023","",""
"1700584830-143","https://scholar.google.com/scholar?hl=en&as_sdt=0%2C5&as_ylo=2023&as_yhi=2023&q=kecerdasan+buatan+untuk+deteksi+penyakit+hewan&btnG=","https://scholar.google.com/scholar?start=204&q=kecerdasan+buatan+untuk+deteksi+penyakit+hewan&hl=en&as_sdt=0,5&as_ylo=2023&as_yhi=2023","Rancang bangun sistem pemantauan kegaduhan pengunjung Perpustakaan dengan pemberi peringatan menggunakan LED dan Telegram","… batas maksimum yang dianjurkan untuk rumah sakit adalah 35 dB – 45 dB, untuk … Dan 

ambang sakit adalah … buatan pabrik untuk mengetahui nilai akurasi sensor GY-MAX4466 dengan …","SN Fitriani - repository.uinjkt.ac.id","[PDF] uinjkt.ac.id","https://repository.uinjkt.ac.id/dspace/bitstream/123456789/69143/1/SHOFI%20NUR%20FITRIANI-FST.pdf"
"1700584830-144","https://scholar.google.com/scholar?hl=en&as_sdt=0%2C5&as_ylo=2023&as_yhi=2023&q=kecerdasan+buatan+untuk+deteksi+penyakit+hewan&btnG=","https://scholar.google.com/scholar?start=204&q=kecerdasan+buatan+untuk+deteksi+penyakit+hewan&hl=en&as_sdt=0,5&as_ylo=2023&as_yhi=2023","Manajemen Risiko Bisnis Era Digital","… dengan robot dan kecerdasan buatan. Era industri 5.0 ini memanfaatkan teknologi IoT untuk 

menggabungkan kecerdasan buatan dengan pikiran manusia. Era industri 5.0 hadir bukan …","MA Tabun, DS Hariyani, M Sulistyowati, B Karollah… - 2023 - books.google.com","[HTML] google.com","https://books.google.com/books?hl=en&lr=&id=OCSnEAAAQBAJ&oi=fnd&pg=PP1&dq=kecerdasan+buatan+untuk+deteksi+penyakit+hewan&ots=Z-rNLYBe3U&sig=st6OFXBFhAOW-g1ug1KehQMezVE"
"1700584833-145","https://scholar.google.com/scholar?hl=en&as_sdt=0%2C5&as_ylo=2023&as_yhi=2023&q=kecerdasan+buatan+untuk+deteksi+penyakit+hewan&btnG=","https://scholar.google.com/scholar?start=194&q=kecerdasan+buatan+untuk+deteksi+penyakit+hewan&hl=en&as_sdt=0,5&as_ylo=2023&as_yhi=2023","Metodologi Penelitian Pariwisata","… Penelitian ini dapat diklasifikasikan dan hubungan gejala … Analisis masalah atau 

gejala-gejala kesenjangan sebagai penyimpangan yang menyebabkan masalah ini perlu teliti dan …","S Hidayatullah, S Alvianna - 2023 - books.google.com","Metodologi Penelitian Pariwisata","https://books.google.com/books?hl=en&lr=&id=Z4ezEAAAQBAJ&oi=fnd&pg=PA1&dq=kecerdasan+buatan+untuk+deteksi+penyakit+hewan&ots=Jo8dwW8RJL&sig=JnLpG3gYyUyUxv1GJ1LYnzEPPpk"
"1700584833-146","https://scholar.google.com/scholar?hl=en&as_sdt=0%2C5&as_ylo=2023&as_yhi=2023&q=kecerdasan+buatan+untuk+deteksi+penyakit+hewan&btnG=","https://scholar.google.com/scholar?start=194&q=kecerdasan+buatan+untuk+deteksi+penyakit+hewan&hl=en&as_sdt=0,5&as_ylo=2023&as_yhi=2023","PANGAN DAN GIZI DALAM DIMENSI BIO-ECO-CULTURE","… tertentu makan tumbuhan maupun hewan, dan tidak … Penyakit pada balita bukan hanya 

menyebabkan gangguan berat badan, jangka panjang yang dapat mempengaruhi kecerdasan …","MM Rahayu - Ekologi Pangan dan Gizi, 2023 - books.google.com","PANGAN DAN GIZI DALAM DIMENSI BIO-ECO-CULTURE","https://books.google.com/books?hl=en&lr=&id=m8zMEAAAQBAJ&oi=fnd&pg=PA63&dq=kecerdasan+buatan+untuk+deteksi+penyakit+hewan&ots=6me_w2uqOa&sig=m9kJoHB6PK3X4TGVrMZnYumZkEk"
"1700584833-147","https://scholar.google.com/scholar?hl=en&as_sdt=0%2C5&as_ylo=2023&as_yhi=2023&q=kecerdasan+buatan+untuk+deteksi+penyakit+hewan&btnG=","https://scholar.google.com/scholar?start=194&q=kecerdasan+buatan+untuk+deteksi+penyakit+hewan&hl=en&as_sdt=0,5&as_ylo=2023&as_yhi=2023","Klasifikasi gelombang otak pada remaja saat kondisi cemas dan dzikir istighfar menggunakan metode K-Nearest Neighbor (KNN)","… dokumentasi dalam percobaan pada lobus cerebral hewan. Percobaan ini menghasilkan 

nilai … adalah untuk mendiagnosis penyakit epilepsi dan sebagai deteksi kelainan terkait fungsi …","AN TASYAKURANTI - eprints.walisongo.ac.id","[PDF] walisongo.ac.id","https://eprints.walisongo.ac.id/21936/1/Skripsi_1908026003_Alvania_Nabila_Tasyakuranti.pdf"
"1700584833-148","https://scholar.google.com/scholar?hl=en&as_sdt=0%2C5&as_ylo=2023&as_yhi=2023&q=kecerdasan+buatan+untuk+deteksi+penyakit+hewan&btnG=","https://scholar.google.com/scholar?start=194&q=kecerdasan+buatan+untuk+deteksi+penyakit+hewan&hl=en&as_sdt=0,5&as_ylo=2023&as_yhi=2023","Pengaruh Model Pembelajaran Cooperative Integrated Reading and Composition (CIRC) Berbantuan Media Canva Terhadap Motivasi dan Hasil Belajar Siswa Pada …","… Variabel Independen adalah variabel yang diukur, dimanipulasi, atau dipilih oleh peneliti 

untuk menentukan hubungannya dengan gejala yang diamati15. Dalam penelitian ini yang …","SA Alfariza - 2023 - digilib.uinkhas.ac.id","[PDF] uinkhas.ac.id","http://digilib.uinkhas.ac.id/26708/1/SKRIPSI%20SYAFIRA%20ALVINA%20ALFARIZA_T20198061.pdf"
"1700584833-149","https://scholar.google.com/scholar?hl=en&as_sdt=0%2C5&as_ylo=2023&as_yhi=2023&q=kecerdasan+buatan+untuk+deteksi+penyakit+hewan&btnG=","https://scholar.google.com/scholar?start=194&q=kecerdasan+buatan+untuk+deteksi+penyakit+hewan&hl=en&as_sdt=0,5&as_ylo=2023&as_yhi=2023","Senolitik: Selektif menginduksi kematian sel tua untuk meningkatkan kesehatan manusia","… secara luas sebagai strategi yang efektif untuk memperpanjang umur maksimum hewan 

model termasuk nematoda, lalat buah, dan tikus. … Penggunaan model kecerdasan buatan …","F Sabry - 2023 - books.google.com","Senolitik: Selektif menginduksi kematian sel tua untuk meningkatkan kesehatan manusia","https://books.google.com/books?hl=en&lr=&id=krK3EAAAQBAJ&oi=fnd&pg=PT301&dq=kecerdasan+buatan+untuk+deteksi+penyakit+hewan&ots=g6Wm89gstw&sig=BicSZXSaB2hdycTqI0VtO8HT9AA"
"1700584833-150","https://scholar.google.com/scholar?hl=en&as_sdt=0%2C5&as_ylo=2023&as_yhi=2023&q=kecerdasan+buatan+untuk+deteksi+penyakit+hewan&btnG=","https://scholar.google.com/scholar?start=194&q=kecerdasan+buatan+untuk+deteksi+penyakit+hewan&hl=en&as_sdt=0,5&as_ylo=2023&as_yhi=2023","BAB 4 SISTEM OTOT PADA MANUSIA","… Otot merupakan jaringan dalam tubuh manusia ataupun hewan yang mempunyai fungsi 

sebagai alat gerak aktif yang membantu pergerakan tulang. Otot dapat mengalami perubahan …","RR Sinaga - ANATOMI DAN FISIOLOGI TUBUH MANUSIA, 2023 - books.google.com","BAB 4 SISTEM OTOT PADA MANUSIA","https://books.google.com/books?hl=en&lr=&id=e77QEAAAQBAJ&oi=fnd&pg=PA45&dq=kecerdasan+buatan+untuk+deteksi+penyakit+hewan&ots=sRzjT8RqWT&sig=riTNnTiIY5T5JFc23r9KiA1KCRo"
"1700584833-151","https://scholar.google.com/scholar?hl=en&as_sdt=0%2C5&as_ylo=2023&as_yhi=2023&q=kecerdasan+buatan+untuk+deteksi+penyakit+hewan&btnG=","https://scholar.google.com/scholar?start=194&q=kecerdasan+buatan+untuk+deteksi+penyakit+hewan&hl=en&as_sdt=0,5&as_ylo=2023&as_yhi=2023","Perokok Aktif dan Perokok Pasif","… Oleh sebab itu, apabila seseorang yang merokok akan menyebab ketergantungan dan dapat 

menimbulkan berbagai macam penyakit baik fisik maupun penyakit dalam. Sementara itu, …","AR Subagya - 2023 - books.google.com","Perokok Aktif dan Perokok Pasif","https://books.google.com/books?hl=en&lr=&id=1ObPEAAAQBAJ&oi=fnd&pg=PP1&dq=kecerdasan+buatan+untuk+deteksi+penyakit+hewan&ots=gPqTnZX9wl&sig=tH-h69-cmIimR8vG91oxqvfwDlo"
"1700584833-152","https://scholar.google.com/scholar?hl=en&as_sdt=0%2C5&as_ylo=2023&as_yhi=2023&q=kecerdasan+buatan+untuk+deteksi+penyakit+hewan&btnG=","https://scholar.google.com/scholar?start=194&q=kecerdasan+buatan+untuk+deteksi+penyakit+hewan&hl=en&as_sdt=0,5&as_ylo=2023&as_yhi=2023","… INISIASI MENYUSU DINI (IMD) DENGAN KECUKUPAN ASI DAN KEJADIAN IKTERUS PADA BAYI BARU LAHIR DI RUMAH SAKIT UMUM HAJI SURABAYA","… Makanan awal bukan ASI mengandung zat putih telur yang bukan berasal dari susu 

manusia, misalnya dari susu hewan. Hal ini dapat menganggu pertumbuhan fungsi usus dan …","DWI RIYANTI - 2023 - repository.unair.ac.id","[PDF] unair.ac.id","https://repository.unair.ac.id/122983/1/Dwi%20Riyanti_131111180%20%28br%29%20UNGGAH%20FINAL%202.pdf"
"1700584833-153","https://scholar.google.com/scholar?hl=en&as_sdt=0%2C5&as_ylo=2023&as_yhi=2023&q=kecerdasan+buatan+untuk+deteksi+penyakit+hewan&btnG=","https://scholar.google.com/scholar?start=194&q=kecerdasan+buatan+untuk+deteksi+penyakit+hewan&hl=en&as_sdt=0,5&as_ylo=2023&as_yhi=2023","E-PUB SEBAGAI TEKNOLOGI PENDUKUNG PEMBELAJARAN BAGI PENYANDANG DISABILITAS NETRA","Fakta di lapangan menunjukkan adanya mahasiswa disabilitas netra yang sulit lulus karena 

keterbatasan penglihatan dalam belajar dan mengakses informasi yang diperlukan untuk …","D Martiningsih - OPTIMALISASI PEMANFAATAN TEKNOLOGI …, 2023 - osf.io","[PDF] osf.io","https://osf.io/m3rf7/download#page=44"
"1700584833-154","https://scholar.google.com/scholar?hl=en&as_sdt=0%2C5&as_ylo=2023&as_yhi=2023&q=kecerdasan+buatan+untuk+deteksi+penyakit+hewan&btnG=","https://scholar.google.com/scholar?start=194&q=kecerdasan+buatan+untuk+deteksi+penyakit+hewan&hl=en&as_sdt=0,5&as_ylo=2023&as_yhi=2023","PERBEDAAN HASIL BELAJAR PESERTA DIDIK MENGGUNAKAN MODEL PEMBELAJARAN SNOWBALL THROWING DENGAN MENGGUNAKAN MODEL …","… dengan materi bagian-bagian tubuh hewan dan fungsi dan bagian-bagian tumbuhan dan 

… dan klasifikasi data yang berhubungan langsung dengan gejala alam di sekitar kita melalui …","B SANTOSO - repository.radenintan.ac.id","[PDF] radenintan.ac.id","http://repository.radenintan.ac.id/28031/1/PUSAT%201%202%20BAHTIAR.pdf"
"1700584836-155","https://scholar.google.com/scholar?hl=en&as_sdt=0%2C5&as_ylo=2023&as_yhi=2023&q=kecerdasan+buatan+untuk+deteksi+penyakit+hewan&btnG=","https://scholar.google.com/scholar?start=154&q=kecerdasan+buatan+untuk+deteksi+penyakit+hewan&hl=en&as_sdt=0,5&as_ylo=2023&as_yhi=2023","","","RO RANI OKTAVIA - 2023 - Sekolah Tinggi Ilmu Kesehatan Bina …","",""
"1700584836-156","https://scholar.google.com/scholar?hl=en&as_sdt=0%2C5&as_ylo=2023&as_yhi=2023&q=kecerdasan+buatan+untuk+deteksi+penyakit+hewan&btnG=","https://scholar.google.com/scholar?start=154&q=kecerdasan+buatan+untuk+deteksi+penyakit+hewan&hl=en&as_sdt=0,5&as_ylo=2023&as_yhi=2023","Teknik Sipil","… terpisah, menghalangi pergerakan hewan liar dan mengganggu … satwa liar, dan menghambat 

migrasi dan reproduksi hewan. … navigasi, dan kecerdasan buatan untuk beroperasi tanpa …","B Witjaksana, DDJ Leihitu, M Al Dianty - 2023 - books.google.com","Teknik Sipil","https://books.google.com/books?hl=en&lr=&id=6UvhEAAAQBAJ&oi=fnd&pg=PA12&dq=kecerdasan+buatan+untuk+deteksi+penyakit+hewan&ots=TFGjRQkGRG&sig=oE6n5Hgzm6BrKffXx4ujosvgxAQ"
"1700584836-157","https://scholar.google.com/scholar?hl=en&as_sdt=0%2C5&as_ylo=2023&as_yhi=2023&q=kecerdasan+buatan+untuk+deteksi+penyakit+hewan&btnG=","https://scholar.google.com/scholar?start=154&q=kecerdasan+buatan+untuk+deteksi+penyakit+hewan&hl=en&as_sdt=0,5&as_ylo=2023&as_yhi=2023","Filsafat Manusia: Mengungkap Hakikat, Misteri, dan Problem Kemanusiaan Kontemporer","… sebagai sebuah gejala dari proses penyembuhan atas penyakit … lebih besar dibandingkan 

dengan hewan. Lebih lanjut dicatat … : Kecerdasan buatan yang ditambahkan kepada suatu …","SD Maharani, FS Marunduri, R Febriani, S Hum, M Fils… - 2023 - books.google.com","Filsafat Manusia: Mengungkap Hakikat, Misteri, dan Problem Kemanusiaan Kontemporer","https://books.google.com/books?hl=en&lr=&id=n9riEAAAQBAJ&oi=fnd&pg=PR1&dq=kecerdasan+buatan+untuk+deteksi+penyakit+hewan&ots=WzoMZdjWQD&sig=HvOOQEk-9FJaMGgo3ZhJPVQEsMs"
"1700584836-158","https://scholar.google.com/scholar?hl=en&as_sdt=0%2C5&as_ylo=2023&as_yhi=2023&q=kecerdasan+buatan+untuk+deteksi+penyakit+hewan&btnG=","https://scholar.google.com/scholar?start=154&q=kecerdasan+buatan+untuk+deteksi+penyakit+hewan&hl=en&as_sdt=0,5&as_ylo=2023&as_yhi=2023","PROTOTYPE ALAT PENGUKUR BERAT BADAN BERBASIS COMPUTER VISION DENGAN MENGGUNAKAN REGRESI LINIER","… citra digital dari kamera dengan kecerdasan buatan yang umumnya menggunakan pendekatan 

… Computer vision juga telah diterapkan pada pengukuran (prediksi) berat badan hewan …","R FIRMANSYAH - 2023 - repository.unissula.ac.id","[PDF] unissula.ac.id","http://repository.unissula.ac.id/29651/1/Teknik%20Informatika_32601700022_fullpdf.pdf"
"1700584836-159","https://scholar.google.com/scholar?hl=en&as_sdt=0%2C5&as_ylo=2023&as_yhi=2023&q=kecerdasan+buatan+untuk+deteksi+penyakit+hewan&btnG=","https://scholar.google.com/scholar?start=154&q=kecerdasan+buatan+untuk+deteksi+penyakit+hewan&hl=en&as_sdt=0,5&as_ylo=2023&as_yhi=2023","Manajemen Pendidikan: Mengurai benang kusut, mencari jalan keluar","… kita bisa memaknai konsep kecerdasan sistem ini sebagai kemampuan kita untuk … Kebutuhan 

ini berhubungan dengan level terendah perilaku yang menyerupai tumbuhan atau hewan, …","A Sanusi - 2023 - books.google.com","Manajemen Pendidikan: Mengurai benang kusut, mencari jalan keluar","https://books.google.com/books?hl=en&lr=&id=alawEAAAQBAJ&oi=fnd&pg=PP1&dq=kecerdasan+buatan+untuk+deteksi+penyakit+hewan&ots=ZImtD1eClt&sig=EACLtG2n21dmwTIbLUeahruG0eA"
"1700584836-160","https://scholar.google.com/scholar?hl=en&as_sdt=0%2C5&as_ylo=2023&as_yhi=2023&q=kecerdasan+buatan+untuk+deteksi+penyakit+hewan&btnG=","https://scholar.google.com/scholar?start=154&q=kecerdasan+buatan+untuk+deteksi+penyakit+hewan&hl=en&as_sdt=0,5&as_ylo=2023&as_yhi=2023","HUBUNGAN PENGETAHUAN, SIKAP, DAN TINDAKAN KONSUMSI MAKANAN JAJANAN AMAN DENGAN STATUS GIZI PADA SISWA DI SMK NEGERI 1 GIANYAR","… malnutrisi jangka panjang atau sering sakit dapat diidentifikasi dengan menggunakan indeks 

… Kecerdasan seseorang dalam memilih jajanan bergizi berasal dari keakrabannya dengan …","DMRJJ Patni - 2023 - repository.poltekkes-denpasar.ac.id","[PDF] poltekkes-denpasar.ac.id","http://repository.poltekkes-denpasar.ac.id/10660/3/BAB%20II.pdf"
"1700584836-161","https://scholar.google.com/scholar?hl=en&as_sdt=0%2C5&as_ylo=2023&as_yhi=2023&q=kecerdasan+buatan+untuk+deteksi+penyakit+hewan&btnG=","https://scholar.google.com/scholar?start=154&q=kecerdasan+buatan+untuk+deteksi+penyakit+hewan&hl=en&as_sdt=0,5&as_ylo=2023&as_yhi=2023","Pendidikan Kesehatan melalui 8 (Delapan) Pesan Perilaku Hidup Bersih dan Sehat (PHBS) pada Guru TK/PAUD","… tidak hanya datang ke rumah sakit atau puskesmas ketika sakit saja. Langkah ini memiliki 

manfaat untuk dapat memudahkan mendeteksi penyakit atau masalah kesehatan lebih dini. …","J Parlaungan, M Loihala, SGP Tambunan, R Mensen… - 2023 - books.google.com","Pendidikan Kesehatan melalui 8 (Delapan) Pesan Perilaku Hidup Bersih dan Sehat (PHBS) pada Guru TK/PAUD","https://books.google.com/books?hl=en&lr=&id=89qsEAAAQBAJ&oi=fnd&pg=PR1&dq=kecerdasan+buatan+untuk+deteksi+penyakit+hewan&ots=kfE2zz0Ed9&sig=278CUG5plz-88e-D0bsZszgCVmA"
"1700584836-162","https://scholar.google.com/scholar?hl=en&as_sdt=0%2C5&as_ylo=2023&as_yhi=2023&q=kecerdasan+buatan+untuk+deteksi+penyakit+hewan&btnG=","https://scholar.google.com/scholar?start=154&q=kecerdasan+buatan+untuk+deteksi+penyakit+hewan&hl=en&as_sdt=0,5&as_ylo=2023&as_yhi=2023","LKP: Manajemen Sumber Daya Manusia Masa Depan Berbasis Digital di Yayasan Insan Indonesia Kompeten","… kecerdasan buatan (AI). Ini hanya akan meningkatkan kepentingan mereka di masa depan. 

Dengan memahami apa itu soft skills dan mencari tahu bagaimana mengembangkan soft …","ML Afandi - 2023 - repository.dinamika.ac.id","[PDF] dinamika.ac.id","https://repository.dinamika.ac.id/id/eprint/6918/1/19430100025-2023-UNIVERSITASDINAMIKA.pdf"
"1700584836-163","https://scholar.google.com/scholar?hl=en&as_sdt=0%2C5&as_ylo=2023&as_yhi=2023&q=kecerdasan+buatan+untuk+deteksi+penyakit+hewan&btnG=","https://scholar.google.com/scholar?start=154&q=kecerdasan+buatan+untuk+deteksi+penyakit+hewan&hl=en&as_sdt=0,5&as_ylo=2023&as_yhi=2023","","","S Usman - 2023 - Penerbit Lakeisha","",""
"1700584836-164","https://scholar.google.com/scholar?hl=en&as_sdt=0%2C5&as_ylo=2023&as_yhi=2023&q=kecerdasan+buatan+untuk+deteksi+penyakit+hewan&btnG=","https://scholar.google.com/scholar?start=154&q=kecerdasan+buatan+untuk+deteksi+penyakit+hewan&hl=en&as_sdt=0,5&as_ylo=2023&as_yhi=2023","TITIK MULAT WIDYASTUTI, S. Pd,. M. Si NIS. 19641123201805 2 019","… Dari uraian di atas dapat kita simpulkan bahwa, Gejala … suatu organisme atau sistem 

kecerdasan buatan tidak mengetahui … daging didekatkan pada anjing, anjing mengeluarkan air …","B AJAR - repository.upy.ac.id","[PDF] upy.ac.id","http://repository.upy.ac.id/4074/1/bahan%20ajar%20psikologi-pendidikan-tahun_2023.pdf"
"1700584839-165","https://scholar.google.com/scholar?hl=en&as_sdt=0%2C5&as_ylo=2023&as_yhi=2023&q=kecerdasan+buatan+untuk+deteksi+penyakit+hewan&btnG=","https://scholar.google.com/scholar?start=144&q=kecerdasan+buatan+untuk+deteksi+penyakit+hewan&hl=en&as_sdt=0,5&as_ylo=2023&as_yhi=2023","BUKU REFERENSI SISTEM INFORMASI BERBASIS KEARIFAN LOKAL","… informasi, seperti kecerdasan buatan, Internet of Things, blockchain, dan analitik prediktif. … 

dan pengalaman tentang lingkungan lokal, seperti tanaman, hewan, iklim, dan ekosistem. Ia …","C Anwar, S Kom, M Kom, CNPL Santiari, Z Sitorus - 2023 - repository.upstegal.ac.id","[PDF] upstegal.ac.id","http://repository.upstegal.ac.id/7174/1/BUKU%20REFERENSI%20SISTEM%20INFORMASI%20BERBASIS%20KEARIFAN%20LOKAL%20E-Book.pdf"
"1700584839-166","https://scholar.google.com/scholar?hl=en&as_sdt=0%2C5&as_ylo=2023&as_yhi=2023&q=kecerdasan+buatan+untuk+deteksi+penyakit+hewan&btnG=","https://scholar.google.com/scholar?start=144&q=kecerdasan+buatan+untuk+deteksi+penyakit+hewan&hl=en&as_sdt=0,5&as_ylo=2023&as_yhi=2023","TA: ANALISIS BIAYA PENGOPERASI AN ALAT MESIN PERTANIAN FERTILIZER APLICATOR DALAM MENUNJANG PROSES PEMUPUKAN MEKANIS PADA …","… secara kreatif dan mengembangkan kecerdasan pengurus; … tebu dan mesin rumah potong 

hewan serta mesin lainnya; … Relevan dalam mendeteksi penyakit dan hama tanaman di …","A Maulana - 2023 - repository.polinela.ac.id","[PDF] polinela.ac.id","http://repository.polinela.ac.id/4145/3/BAB1%262_Afreza%20Maulana_20732040.pdf"
"1700584839-167","https://scholar.google.com/scholar?hl=en&as_sdt=0%2C5&as_ylo=2023&as_yhi=2023&q=kecerdasan+buatan+untuk+deteksi+penyakit+hewan&btnG=","https://scholar.google.com/scholar?start=144&q=kecerdasan+buatan+untuk+deteksi+penyakit+hewan&hl=en&as_sdt=0,5&as_ylo=2023&as_yhi=2023","IMPLEMENTASI K-OPTIMAL PADA ALGORITMA K-NEAREST NEIGHBOR UNTUK KLASIFIKASI KETERTARIKAN MASYARAKAT DALAM PEMBELIAN ASURANSI …","… , penemuan roda untuk transportasi lalu memanfaatkan hewan untuk ditunggangi seperti kuda 

dan … Artificial Intelligence atau kecerdasan buatan adalah kecerdasan yang ditambahkan, …","ID QORRY - 2023 - digilib.unila.ac.id","[PDF] unila.ac.id","http://digilib.unila.ac.id/69875/3/SKRIPSI%20TANPA%20BAB%20PEMBAHASAN.pdf"
"1700584839-168","https://scholar.google.com/scholar?hl=en&as_sdt=0%2C5&as_ylo=2023&as_yhi=2023&q=kecerdasan+buatan+untuk+deteksi+penyakit+hewan&btnG=","https://scholar.google.com/scholar?start=144&q=kecerdasan+buatan+untuk+deteksi+penyakit+hewan&hl=en&as_sdt=0,5&as_ylo=2023&as_yhi=2023","STUDI ANALISIS BAHAN TAMBAHAN PANGAN BERBAHAYA DAN ANALISIS TITIK KRITIS HALAL PRODUK PANGAN DI PASAR BLIMBING KOTA …","… faktor kesehatan dan keamanan konsumen, sehingga makanan yang seharusnya halal 

dan juga baik untuk dikonsumsi menjadi tidak sehat dan menjadi penyebab berbagai penyakit …","IWA Supardi - 2023 - etd.umm.ac.id","STUDI ANALISIS BAHAN TAMBAHAN PANGAN BERBAHAYA DAN ANALISIS TITIK KRITIS HALAL PRODUK PANGAN DI PASAR BLIMBING KOTA …","https://etd.umm.ac.id/id/eprint/2686/"
"1700584839-169","https://scholar.google.com/scholar?hl=en&as_sdt=0%2C5&as_ylo=2023&as_yhi=2023&q=kecerdasan+buatan+untuk+deteksi+penyakit+hewan&btnG=","https://scholar.google.com/scholar?start=144&q=kecerdasan+buatan+untuk+deteksi+penyakit+hewan&hl=en&as_sdt=0,5&as_ylo=2023&as_yhi=2023","Good Governance (Kepemerintahan yang Baik) Di Era Digital","… etis tentang pengeditan genom pada manusia dan hewan. Sifat politik dari teknologi maju 

… Dalam era RI 4.0, kita harus mulai belajar bekerja bersama robot dan kecerdasan buatan …","SH Siti Marwiyah, MP Sedarmayanti… - 2023 - books.google.com","Good Governance (Kepemerintahan yang Baik) Di Era Digital","https://books.google.com/books?hl=en&lr=&id=S6rLEAAAQBAJ&oi=fnd&pg=PP1&dq=kecerdasan+buatan+untuk+deteksi+penyakit+hewan&ots=DiFvIloBNG&sig=_cYz24T9l2K8ndD6ULyRxtvOBhM"
"1700584839-170","https://scholar.google.com/scholar?hl=en&as_sdt=0%2C5&as_ylo=2023&as_yhi=2023&q=kecerdasan+buatan+untuk+deteksi+penyakit+hewan&btnG=","https://scholar.google.com/scholar?start=144&q=kecerdasan+buatan+untuk+deteksi+penyakit+hewan&hl=en&as_sdt=0,5&as_ylo=2023&as_yhi=2023","Islamic Leadership: Membangun Superleadership Melalui Kecerdasan Spiritual","… terhadap lingkungan dan hewan pun rasa kasih sayang itu masih beliau perlakukan. Dialah 

manusia yang menangis sesenggukan saat melihat hewan yang diperlakukan kasar oleh si …","MBA H Veithzal Rivai, IHA Arifin - 2023 - books.google.com","Islamic Leadership: Membangun Superleadership Melalui Kecerdasan Spiritual","https://books.google.com/books?hl=en&lr=&id=VUOoEAAAQBAJ&oi=fnd&pg=PP1&dq=kecerdasan+buatan+untuk+deteksi+penyakit+hewan&ots=cqlZtgwz-M&sig=65Jfl_p4ItctKjHOgPK8TAhaoH4"
"1700584839-171","https://scholar.google.com/scholar?hl=en&as_sdt=0%2C5&as_ylo=2023&as_yhi=2023&q=kecerdasan+buatan+untuk+deteksi+penyakit+hewan&btnG=","https://scholar.google.com/scholar?start=144&q=kecerdasan+buatan+untuk+deteksi+penyakit+hewan&hl=en&as_sdt=0,5&as_ylo=2023&as_yhi=2023","SISTEM KOMPUTER DAN INFORMASI","… makanan untuk hewan herbivora, dan hewan tersebut berfungsi … atau kendaraan berbasis 

kecerdasan buatan adalah contoh … Menggunakan contoh basis data rumah sakit sebelumnya, …","IA Prabowo, S Pomalingo, W Istiono, A Muhariya… - 2023 - books.google.com","SISTEM KOMPUTER DAN INFORMASI","https://books.google.com/books?hl=en&lr=&id=ItLcEAAAQBAJ&oi=fnd&pg=PA164&dq=kecerdasan+buatan+untuk+deteksi+penyakit+hewan&ots=3O6efNC9uF&sig=W_GGNzELuhZlR7p064lw5XqHMZk"
