web-scraper-order,web-scraper-start-url,halaman_pencarian,judul,excerpt,author,link_pencarian,link_pencarian-href
"1700584920-439","https://scholar.google.com/scholar?hl=en&as_sdt=0%2C5&as_ylo=2023&as_yhi=2023&q=kecerdasan+buatan+untuk+deteksi+penyakit+hewan&btnG=","https://scholar.google.com/scholar?start=190&q=kecerdasan+buatan+untuk+deteksi+penyakit+hewan&hl=en&as_sdt=0,5&as_ylo=2023&as_yhi=2023","Metodologi Penelitian Pariwisata","… Penelitian ini dapat diklasifikasikan dan hubungan gejala … Analisis masalah atau 

gejala-gejala kesenjangan sebagai penyimpangan yang menyebabkan masalah ini perlu teliti dan …","S Hidayatullah, S Alvianna - 2023 - books.google.com","Metodologi Penelitian Pariwisata","https://books.google.com/books?hl=en&lr=&id=Z4ezEAAAQBAJ&oi=fnd&pg=PA1&dq=kecerdasan+buatan+untuk+deteksi+penyakit+hewan&ots=Jo8dwW8SHS&sig=Y6ykLm4AEO3VWYOJXh0S41kCiM4"
"1700584920-440","https://scholar.google.com/scholar?hl=en&as_sdt=0%2C5&as_ylo=2023&as_yhi=2023&q=kecerdasan+buatan+untuk+deteksi+penyakit+hewan&btnG=","https://scholar.google.com/scholar?start=190&q=kecerdasan+buatan+untuk+deteksi+penyakit+hewan&hl=en&as_sdt=0,5&as_ylo=2023&as_yhi=2023","PANGAN DAN GIZI DALAM DIMENSI BIO-ECO-CULTURE","… tertentu makan tumbuhan maupun hewan, dan tidak … Penyakit pada balita bukan hanya 

menyebabkan gangguan berat badan, jangka panjang yang dapat mempengaruhi kecerdasan …","MM Rahayu - Ekologi Pangan dan Gizi, 2023 - books.google.com","PANGAN DAN GIZI DALAM DIMENSI BIO-ECO-CULTURE","https://books.google.com/books?hl=en&lr=&id=m8zMEAAAQBAJ&oi=fnd&pg=PA63&dq=kecerdasan+buatan+untuk+deteksi+penyakit+hewan&ots=6me_w2urMh&sig=HOTSKM9aM9ZP0WuUejOuSQu52lk"
"1700584920-441","https://scholar.google.com/scholar?hl=en&as_sdt=0%2C5&as_ylo=2023&as_yhi=2023&q=kecerdasan+buatan+untuk+deteksi+penyakit+hewan&btnG=","https://scholar.google.com/scholar?start=190&q=kecerdasan+buatan+untuk+deteksi+penyakit+hewan&hl=en&as_sdt=0,5&as_ylo=2023&as_yhi=2023","Klasifikasi gelombang otak pada remaja saat kondisi cemas dan dzikir istighfar menggunakan metode K-Nearest Neighbor (KNN)","… dokumentasi dalam percobaan pada lobus cerebral hewan. Percobaan ini menghasilkan 

nilai … adalah untuk mendiagnosis penyakit epilepsi dan sebagai deteksi kelainan terkait fungsi …","AN TASYAKURANTI - eprints.walisongo.ac.id","[PDF] walisongo.ac.id","https://eprints.walisongo.ac.id/21936/1/Skripsi_1908026003_Alvania_Nabila_Tasyakuranti.pdf"
"1700584920-442","https://scholar.google.com/scholar?hl=en&as_sdt=0%2C5&as_ylo=2023&as_yhi=2023&q=kecerdasan+buatan+untuk+deteksi+penyakit+hewan&btnG=","https://scholar.google.com/scholar?start=190&q=kecerdasan+buatan+untuk+deteksi+penyakit+hewan&hl=en&as_sdt=0,5&as_ylo=2023&as_yhi=2023","Pengaruh Model Pembelajaran Cooperative Integrated Reading and Composition (CIRC) Berbantuan Media Canva Terhadap Motivasi dan Hasil Belajar Siswa Pada …","… Variabel Independen adalah variabel yang diukur, dimanipulasi, atau dipilih oleh peneliti 

untuk menentukan hubungannya dengan gejala yang diamati15. Dalam penelitian ini yang …","SA Alfariza - 2023 - digilib.uinkhas.ac.id","[PDF] uinkhas.ac.id","http://digilib.uinkhas.ac.id/26708/1/SKRIPSI%20SYAFIRA%20ALVINA%20ALFARIZA_T20198061.pdf"
"1700584920-443","https://scholar.google.com/scholar?hl=en&as_sdt=0%2C5&as_ylo=2023&as_yhi=2023&q=kecerdasan+buatan+untuk+deteksi+penyakit+hewan&btnG=","https://scholar.google.com/scholar?start=190&q=kecerdasan+buatan+untuk+deteksi+penyakit+hewan&hl=en&as_sdt=0,5&as_ylo=2023&as_yhi=2023","Senolitik: Selektif menginduksi kematian sel tua untuk meningkatkan kesehatan manusia","… secara luas sebagai strategi yang efektif untuk memperpanjang umur maksimum hewan 

model termasuk nematoda, lalat buah, dan tikus. … Penggunaan model kecerdasan buatan …","F Sabry - 2023 - books.google.com","Senolitik: Selektif menginduksi kematian sel tua untuk meningkatkan kesehatan manusia","https://books.google.com/books?hl=en&lr=&id=krK3EAAAQBAJ&oi=fnd&pg=PT301&dq=kecerdasan+buatan+untuk+deteksi+penyakit+hewan&ots=g6Wm89gtrD&sig=Z8Asq_R8QWJQgKKcaEB1cwbaR08"
"1700584920-444","https://scholar.google.com/scholar?hl=en&as_sdt=0%2C5&as_ylo=2023&as_yhi=2023&q=kecerdasan+buatan+untuk+deteksi+penyakit+hewan&btnG=","https://scholar.google.com/scholar?start=190&q=kecerdasan+buatan+untuk+deteksi+penyakit+hewan&hl=en&as_sdt=0,5&as_ylo=2023&as_yhi=2023","BAB 4 SISTEM OTOT PADA MANUSIA","… Otot merupakan jaringan dalam tubuh manusia ataupun hewan yang mempunyai fungsi 

sebagai alat gerak aktif yang membantu pergerakan tulang. Otot dapat mengalami perubahan …","RR Sinaga - ANATOMI DAN FISIOLOGI TUBUH MANUSIA, 2023 - books.google.com","BAB 4 SISTEM OTOT PADA MANUSIA","https://books.google.com/books?hl=en&lr=&id=e77QEAAAQBAJ&oi=fnd&pg=PA45&dq=kecerdasan+buatan+untuk+deteksi+penyakit+hewan&ots=sRzjT8RrU_&sig=qvU2rBKni1IkFGtTOgqnXQ8ey4A"
"1700584923-445","https://scholar.google.com/scholar?hl=en&as_sdt=0%2C5&as_ylo=2023&as_yhi=2023&q=kecerdasan+buatan+untuk+deteksi+penyakit+hewan&btnG=","https://scholar.google.com/scholar?start=180&q=kecerdasan+buatan+untuk+deteksi+penyakit+hewan&hl=en&as_sdt=0,5&as_ylo=2023&as_yhi=2023","Rancang Bangun Prototype Smarthome Pada Rumah Tipe 36 dengan Kendali Smartphone Berbasis IOT (Internet Of Things)","… bertindak seperti manusia dikenal sebagai kecerdasan buatan (AI). Pembelajaran mesin … 

Kecerdasan buatan ini bertugas menyiapkan jaringan, merancang dan mengembangkan …","D Abdullah, U Prayogi, S Asnur, Q Aini, F Santoso - 2023 - repository.unibos.ac.id","[PDF] unibos.ac.id","https://repository.unibos.ac.id/xmlui/bitstream/handle/123456789/6035/buku%20smart%20-%20Syamfitriani%20Asnur.pdf?sequence=1&isAllowed=y"
"1700584923-446","https://scholar.google.com/scholar?hl=en&as_sdt=0%2C5&as_ylo=2023&as_yhi=2023&q=kecerdasan+buatan+untuk+deteksi+penyakit+hewan&btnG=","https://scholar.google.com/scholar?start=180&q=kecerdasan+buatan+untuk+deteksi+penyakit+hewan&hl=en&as_sdt=0,5&as_ylo=2023&as_yhi=2023","Di Mertani Kami Mengabdi","… penyakit yang dapat menimbulkan gejala ringan sampai … makanan kerupuk serta jual beli 

hewan seperti burung. Namun … Melalui konsep ini, diharapkan terdapat kecerdasan buatan …","HA Umaroh, LW Alfani, LA Pramesti, LA Fauzan, L Nisa… - repository.um-surabaya.ac.id","[PDF] um-surabaya.ac.id","https://repository.um-surabaya.ac.id/7780/1/III.C.1%20Buku%20di%20Mertani%20kami%20menngabdi.pdf"
"1700584923-447","https://scholar.google.com/scholar?hl=en&as_sdt=0%2C5&as_ylo=2023&as_yhi=2023&q=kecerdasan+buatan+untuk+deteksi+penyakit+hewan&btnG=","https://scholar.google.com/scholar?start=180&q=kecerdasan+buatan+untuk+deteksi+penyakit+hewan&hl=en&as_sdt=0,5&as_ylo=2023&as_yhi=2023","BAB 3 MOBILE COMPUTING","… adanya teknologi kecerdasan buatan, komputasi kuantum yang sedang berkembang. … 

kelembaban, dan nutrisi tanah, serta kesehatan hewan ternak. Data-data tersebut dapat dianalisis …","N Umar - PEMOGRAMAN MOBILE, 2023 - books.google.com","BAB 3 MOBILE COMPUTING","https://books.google.com/books?hl=en&lr=&id=3b7FEAAAQBAJ&oi=fnd&pg=PA35&dq=kecerdasan+buatan+untuk+deteksi+penyakit+hewan&ots=yglZEdmFjj&sig=05mzKpsPmsvYN2moTfPd_29wfkg"
"1700584923-448","https://scholar.google.com/scholar?hl=en&as_sdt=0%2C5&as_ylo=2023&as_yhi=2023&q=kecerdasan+buatan+untuk+deteksi+penyakit+hewan&btnG=","https://scholar.google.com/scholar?start=180&q=kecerdasan+buatan+untuk+deteksi+penyakit+hewan&hl=en&as_sdt=0,5&as_ylo=2023&as_yhi=2023","Direktorat Guru dan Tenaga Kependidikan Pendidikan Anak Usia Dini (2020) Perkembangan Anak Usia Dini (Modul 2). Jakarta: Kementerian Pendidikan dan …","… -merasakan sentuhan, rasa sakit ataupun merasakan adanya … Berbeda dengan hewan 

primata, saat lahir sudah memiliki otak … Kecerdasan ini dianggap berbeda dengan kecerdasan …","E Hurlock, G Tumbuh - PENGEMBANGAN KOGNITIF ANAK USIA …, 2023 - books.google.com","Direktorat Guru dan Tenaga Kependidikan Pendidikan Anak Usia Dini (2020) Perkembangan Anak Usia Dini (Modul 2). Jakarta: Kementerian Pendidikan dan …","https://books.google.com/books?hl=en&lr=&id=mEzNEAAAQBAJ&oi=fnd&pg=PA63&dq=kecerdasan+buatan+untuk+deteksi+penyakit+hewan&ots=Pb3Y2Bbr-I&sig=m9GqcVGyM0P-Fi6ViYQMmA01XMw"
"1700584923-449","https://scholar.google.com/scholar?hl=en&as_sdt=0%2C5&as_ylo=2023&as_yhi=2023&q=kecerdasan+buatan+untuk+deteksi+penyakit+hewan&btnG=","https://scholar.google.com/scholar?start=180&q=kecerdasan+buatan+untuk+deteksi+penyakit+hewan&hl=en&as_sdt=0,5&as_ylo=2023&as_yhi=2023","PENGARUH PIJAT BAYI TERHADAP DAYA TAHAN TUBUH BAYI DI PMB “X” KABUPATEN JEMBER","… dan tidak mampu mendeteksi bahaya virus eksternal, timbullah penyakit. WHO mengklaim 

… ke manusia atau hewan lain untuk menciptakan kekebalan pasif buatan. Ilustrasi lain adalah …","RP Romadhona, Z Mauludiyah - 2023 - repository.stikesdrsoebandi.ac.id","[PDF] stikesdrsoebandi.ac.id","http://repository.stikesdrsoebandi.ac.id/918/1/19050036%20Rahayu%20Putri%20Romadhona.pdf"
"1700584923-450","https://scholar.google.com/scholar?hl=en&as_sdt=0%2C5&as_ylo=2023&as_yhi=2023&q=kecerdasan+buatan+untuk+deteksi+penyakit+hewan&btnG=","https://scholar.google.com/scholar?start=180&q=kecerdasan+buatan+untuk+deteksi+penyakit+hewan&hl=en&as_sdt=0,5&as_ylo=2023&as_yhi=2023","BAB 4 PROMOSI KESEHATAN DAN GIZI PADA IBU HAMIL","… Penelitian Pavlov yang terkenal tentang classical conditioning dengan saliva anjing telah 

… gizi, skrining dan penanganan penyakit tidak menular dan penyakit menular, imunisasi, dan …","NRB Putri, SKM Kep, SK Kom, S Tarumanagara - Bunga Rampai, 2023 - books.google.com","[PDF] alungcipta.com","https://publisher.alungcipta.com/wp-content/uploads/2023/02/E-Book-No-DOI.pdf#page=61"
"1700584923-451","https://scholar.google.com/scholar?hl=en&as_sdt=0%2C5&as_ylo=2023&as_yhi=2023&q=kecerdasan+buatan+untuk+deteksi+penyakit+hewan&btnG=","https://scholar.google.com/scholar?start=180&q=kecerdasan+buatan+untuk+deteksi+penyakit+hewan&hl=en&as_sdt=0,5&as_ylo=2023&as_yhi=2023","POPULASI DALAM EKOSISTEM","… Seperti yang terjadi pada hewan, habitat hewan dapat mengalami kematian hingga menuju 

kepunahan, tidak hanya karena dimangsa oleh predator, melainkan meningkatnya aktivitas …","S Saputra - Ilmu Lingkungan, 2023 - researchgate.net","[PDF] researchgate.net","https://www.researchgate.net/profile/Andi-Asari/publication/372717403_Ilmu_Lingkungan/links/64c3cba6141074110edf15eb/Ilmu-Lingkungan.pdf#page=57"
"1700584923-452","https://scholar.google.com/scholar?hl=en&as_sdt=0%2C5&as_ylo=2023&as_yhi=2023&q=kecerdasan+buatan+untuk+deteksi+penyakit+hewan&btnG=","https://scholar.google.com/scholar?start=180&q=kecerdasan+buatan+untuk+deteksi+penyakit+hewan&hl=en&as_sdt=0,5&as_ylo=2023&as_yhi=2023","Asuhan Masa Nifas dan Menyusui","… Pelayanan yang diberikan meliputi upaya pencegahan, deteksi dini, dan pengobatan 

komplikasi dan penyakit yang mungkin terjadi, serta penyediaan pelayanan pemberian ASI, cara …","L Mertasari, W Sugandini - 2023 - books.google.com","Asuhan Masa Nifas dan Menyusui","https://books.google.com/books?hl=en&lr=&id=9zrdEAAAQBAJ&oi=fnd&pg=PA1&dq=kecerdasan+buatan+untuk+deteksi+penyakit+hewan&ots=07aEzcMmTS&sig=_IHn3-Yrzde7i76DaXG9J4Hp2Pg"
"1700584923-453","https://scholar.google.com/scholar?hl=en&as_sdt=0%2C5&as_ylo=2023&as_yhi=2023&q=kecerdasan+buatan+untuk+deteksi+penyakit+hewan&btnG=","https://scholar.google.com/scholar?start=180&q=kecerdasan+buatan+untuk+deteksi+penyakit+hewan&hl=en&as_sdt=0,5&as_ylo=2023&as_yhi=2023","Penerapan Algoritma Dense Neural Network untuk Klasifikasi Jenis Sedimen Dasar Laut Menggunakan Data Mosaik dan Pola Fitur Backscatter","… Penelitian ini betujuan untuk mendeteksi, mengklasifikasi dan memprediksi tipe sedimen … 

atau kecerdasan buatan adalah teknik yang dilakukan untuk meniru kecerdasan manusia. …","HC Harisa - 2023 - repository.its.ac.id","[PDF] its.ac.id","https://repository.its.ac.id/101851/1/03311940000014-Undergraduate_Thesis.pdf"
"1700584923-454","https://scholar.google.com/scholar?hl=en&as_sdt=0%2C5&as_ylo=2023&as_yhi=2023&q=kecerdasan+buatan+untuk+deteksi+penyakit+hewan&btnG=","https://scholar.google.com/scholar?start=180&q=kecerdasan+buatan+untuk+deteksi+penyakit+hewan&hl=en&as_sdt=0,5&as_ylo=2023&as_yhi=2023","Aplikasi Pembeda Daging Sapi dan Babi dengan Metode Color Moment dan Local Binary Pattern Histogram","… tinggi, sehingga dapat meningkatkan kecerdasan dan menambah … , sehingga dapat 

meningkatkan kecerdasan dan menambah … dalam produk Pangan Asal Hewan merupakan hal …","O Pribadi - Bulletin of Computer Science Research, 2023 - hostjournals.com","[PDF] hostjournals.com","http://hostjournals.com/bulletincsr/article/download/260/180"
"1700584926-455","https://scholar.google.com/scholar?hl=en&as_sdt=0%2C5&as_ylo=2023&as_yhi=2023&q=kecerdasan+buatan+untuk+deteksi+penyakit+hewan&btnG=","https://scholar.google.com/scholar?start=160&q=kecerdasan+buatan+untuk+deteksi+penyakit+hewan&hl=en&as_sdt=0,5&as_ylo=2023&as_yhi=2023","Pendidikan Kesehatan melalui 8 (Delapan) Pesan Perilaku Hidup Bersih dan Sehat (PHBS) pada Guru TK/PAUD","… tidak hanya datang ke rumah sakit atau puskesmas ketika sakit saja. Langkah ini memiliki 

manfaat untuk dapat memudahkan mendeteksi penyakit atau masalah kesehatan lebih dini. …","J Parlaungan, M Loihala, SGP Tambunan, R Mensen… - 2023 - books.google.com","Pendidikan Kesehatan melalui 8 (Delapan) Pesan Perilaku Hidup Bersih dan Sehat (PHBS) pada Guru TK/PAUD","https://books.google.com/books?hl=en&lr=&id=89qsEAAAQBAJ&oi=fnd&pg=PR1&dq=kecerdasan+buatan+untuk+deteksi+penyakit+hewan&ots=kfE2zz0Fc9&sig=haoawmBk3yFquo649qmUZmXRMNs"
"1700584926-456","https://scholar.google.com/scholar?hl=en&as_sdt=0%2C5&as_ylo=2023&as_yhi=2023&q=kecerdasan+buatan+untuk+deteksi+penyakit+hewan&btnG=","https://scholar.google.com/scholar?start=160&q=kecerdasan+buatan+untuk+deteksi+penyakit+hewan&hl=en&as_sdt=0,5&as_ylo=2023&as_yhi=2023","LKP: Manajemen Sumber Daya Manusia Masa Depan Berbasis Digital di Yayasan Insan Indonesia Kompeten","… kecerdasan buatan (AI). Ini hanya akan meningkatkan kepentingan mereka di masa depan. 

Dengan memahami apa itu soft skills dan mencari tahu bagaimana mengembangkan soft …","ML Afandi - 2023 - repository.dinamika.ac.id","[PDF] dinamika.ac.id","https://repository.dinamika.ac.id/id/eprint/6918/1/19430100025-2023-UNIVERSITASDINAMIKA.pdf"
"1700584926-457","https://scholar.google.com/scholar?hl=en&as_sdt=0%2C5&as_ylo=2023&as_yhi=2023&q=kecerdasan+buatan+untuk+deteksi+penyakit+hewan&btnG=","https://scholar.google.com/scholar?start=160&q=kecerdasan+buatan+untuk+deteksi+penyakit+hewan&hl=en&as_sdt=0,5&as_ylo=2023&as_yhi=2023","","","S Usman - 2023 - Penerbit Lakeisha","",""
"1700584926-458","https://scholar.google.com/scholar?hl=en&as_sdt=0%2C5&as_ylo=2023&as_yhi=2023&q=kecerdasan+buatan+untuk+deteksi+penyakit+hewan&btnG=","https://scholar.google.com/scholar?start=160&q=kecerdasan+buatan+untuk+deteksi+penyakit+hewan&hl=en&as_sdt=0,5&as_ylo=2023&as_yhi=2023","TITIK MULAT WIDYASTUTI, S. Pd,. M. Si NIS. 19641123201805 2 019","… Dari uraian di atas dapat kita simpulkan bahwa, Gejala … suatu organisme atau sistem 

kecerdasan buatan tidak mengetahui … daging didekatkan pada anjing, anjing mengeluarkan air …","B AJAR - repository.upy.ac.id","[PDF] upy.ac.id","http://repository.upy.ac.id/4074/1/bahan%20ajar%20psikologi-pendidikan-tahun_2023.pdf"
"1700584926-459","https://scholar.google.com/scholar?hl=en&as_sdt=0%2C5&as_ylo=2023&as_yhi=2023&q=kecerdasan+buatan+untuk+deteksi+penyakit+hewan&btnG=","https://scholar.google.com/scholar?start=160&q=kecerdasan+buatan+untuk+deteksi+penyakit+hewan&hl=en&as_sdt=0,5&as_ylo=2023&as_yhi=2023","BAB 3 EPIDEMIOLOGI &","… penyakit, terutama penyakit infeksi menular. Dalam perkembangannya, masalah yang 

dihadapi penduduk tidak hanya penyakit menular saja, melainkan juga penyakit tidak menular, …","RS Jamal, MK SKM - Pengantar Kesehatan Ibu dan Anak, 2023 - books.google.com","BAB 3 EPIDEMIOLOGI &","https://books.google.com/books?hl=en&lr=&id=GF68EAAAQBAJ&oi=fnd&pg=PA29&dq=kecerdasan+buatan+untuk+deteksi+penyakit+hewan&ots=mc4Swty-pD&sig=JRyl7IvLnHa00rO1xSFukq9Owww"
"1700584926-460","https://scholar.google.com/scholar?hl=en&as_sdt=0%2C5&as_ylo=2023&as_yhi=2023&q=kecerdasan+buatan+untuk+deteksi+penyakit+hewan&btnG=","https://scholar.google.com/scholar?start=160&q=kecerdasan+buatan+untuk+deteksi+penyakit+hewan&hl=en&as_sdt=0,5&as_ylo=2023&as_yhi=2023","PENGANTAR ILMU PERTANIAN","… sakit dan fasilitas medis lainnya untuk meringankan rasa … produksi tanaman dan hewan, 

dengan hewan yang hidup jauh dari … jauh, dan kecerdasan buatan memungkinkan petani untuk …","VB Panunggul, S Yusra, K Khaerana, S Tuhuteru… - 2023 - books.google.com","[PDF] penerbitwidina.com","https://repository.penerbitwidina.com/media/publications/564795-pengantar-ilmu-pertanian-19d5eb80.pdf"
"1700584926-461","https://scholar.google.com/scholar?hl=en&as_sdt=0%2C5&as_ylo=2023&as_yhi=2023&q=kecerdasan+buatan+untuk+deteksi+penyakit+hewan&btnG=","https://scholar.google.com/scholar?start=160&q=kecerdasan+buatan+untuk+deteksi+penyakit+hewan&hl=en&as_sdt=0,5&as_ylo=2023&as_yhi=2023","1 Penerapan Teknik Mesin dalam Industri Manufaktur","… of Things (IoT), kecerdasan buatan (AI), analitika data, dan otomasi yang lebih canggih. 

Ini memungkinkan integrasi sistem dan produksi yang lebih fleksibel, efisien, dan adaptif. …","TRIW PANGGABEAN - Laporan Kerja Praktek Mahasiswa …, 2023 - coursework.uma.ac.id","[PDF] uma.ac.id","http://coursework.uma.ac.id/index.php/teknik/article/download/312/219"
"1700584926-462","https://scholar.google.com/scholar?hl=en&as_sdt=0%2C5&as_ylo=2023&as_yhi=2023&q=kecerdasan+buatan+untuk+deteksi+penyakit+hewan&btnG=","https://scholar.google.com/scholar?start=160&q=kecerdasan+buatan+untuk+deteksi+penyakit+hewan&hl=en&as_sdt=0,5&as_ylo=2023&as_yhi=2023","BAB 10 ETIKA PENELITIAN KESEHATAN","… Untuk hewan percobaan di laboratorium juga perlu diperlakukan secara manusiawi dan … 

Perkembangan Teknologi Informasi, dengan menggunakan kecerdasan buatan yang sudah …","NE Widiyastuti - Pengantar Metodologi Kesehatan, 2023 - books.google.com","[PDF] researchgate.net","https://www.researchgate.net/profile/Sada-Pustaka/publication/375497377_PENGANTAR_METODOLOGI_KESEHATAN/links/654cc548b86a1d521bc7f729/PENGANTAR-METODOLOGI-KESEHATAN.pdf#page=44"
"1700584926-463","https://scholar.google.com/scholar?hl=en&as_sdt=0%2C5&as_ylo=2023&as_yhi=2023&q=kecerdasan+buatan+untuk+deteksi+penyakit+hewan&btnG=","https://scholar.google.com/scholar?start=160&q=kecerdasan+buatan+untuk+deteksi+penyakit+hewan&hl=en&as_sdt=0,5&as_ylo=2023&as_yhi=2023","Mouse Control Berbasis Eye Tracking Sebagai Alat Bantu Disabilitas","… dalam buku ini, menggunakan sistem eye tracking dimana sistem memperoleh sinyal deteksi 

pupil mata secara realtime untuk menentukan posisi cursor pada layar pengguna. sistem …","HD Kishendrian, H Yusuf, R Andarsyah - 2023 - books.google.com","Mouse Control Berbasis Eye Tracking Sebagai Alat Bantu Disabilitas","https://books.google.com/books?hl=en&lr=&id=6AavEAAAQBAJ&oi=fnd&pg=PA1&dq=kecerdasan+buatan+untuk+deteksi+penyakit+hewan&ots=fnR0tIiEJM&sig=VUmKIeeAEtEExAV4wl-holw2rs4"
"1700584926-464","https://scholar.google.com/scholar?hl=en&as_sdt=0%2C5&as_ylo=2023&as_yhi=2023&q=kecerdasan+buatan+untuk+deteksi+penyakit+hewan&btnG=","https://scholar.google.com/scholar?start=160&q=kecerdasan+buatan+untuk+deteksi+penyakit+hewan&hl=en&as_sdt=0,5&as_ylo=2023&as_yhi=2023","Marketing Di Era 5.0: Transformasi Teknologi Digital Untuk Efisiensi Pemasaran","… Sebab, kalau otak besar menjadi penentu kecerdasan, tentu paus kepala … Hewan secara 

bertahap memiliki otak yang semakin lama semakin besar. Ini semua bertujuan agar hewan …","RK Nugraha - 2023 - books.google.com","Marketing Di Era 5.0: Transformasi Teknologi Digital Untuk Efisiensi Pemasaran","https://books.google.com/books?hl=en&lr=&id=rHHYEAAAQBAJ&oi=fnd&pg=PA4&dq=kecerdasan+buatan+untuk+deteksi+penyakit+hewan&ots=Iez6qq7UCU&sig=lvzw6-B2XEUM-YBvbjpJrTu0afg"
"1700584929-465","https://scholar.google.com/scholar?hl=en&as_sdt=0%2C5&as_ylo=2023&as_yhi=2023&q=kecerdasan+buatan+untuk+deteksi+penyakit+hewan&btnG=","https://scholar.google.com/scholar?start=150&q=kecerdasan+buatan+untuk+deteksi+penyakit+hewan&hl=en&as_sdt=0,5&as_ylo=2023&as_yhi=2023","SISTEM KOMPUTER DAN INFORMASI","… makanan untuk hewan herbivora, dan hewan tersebut berfungsi … atau kendaraan berbasis 

kecerdasan buatan adalah contoh … Menggunakan contoh basis data rumah sakit sebelumnya, …","IA Prabowo, S Pomalingo, W Istiono, A Muhariya… - 2023 - books.google.com","SISTEM KOMPUTER DAN INFORMASI","https://books.google.com/books?hl=en&lr=&id=ItLcEAAAQBAJ&oi=fnd&pg=PA164&dq=kecerdasan+buatan+untuk+deteksi+penyakit+hewan&ots=3O6efNCatF&sig=bzycvAbcDfgFpxfQeCsAZNzJmcM"
"1700584929-466","https://scholar.google.com/scholar?hl=en&as_sdt=0%2C5&as_ylo=2023&as_yhi=2023&q=kecerdasan+buatan+untuk+deteksi+penyakit+hewan&btnG=","https://scholar.google.com/scholar?start=150&q=kecerdasan+buatan+untuk+deteksi+penyakit+hewan&hl=en&as_sdt=0,5&as_ylo=2023&as_yhi=2023","PERANCANGAN SISTEM MONITORING DAN DATA LOGGING GAS METANA (CH4) UNTUK ANALISIS FLUKS KARBON PADA METODE EDDY COVARIANCE …","… permukaan laut, anomali iklim, munculnya berbagai penyakit pada manusia dan hewan. … 

Gambut dan Non-Gambut dengan Metode Kecerdasan Buatan” dengan focus riset adalah …","JP Muhammad - 2023 - digilib.unila.ac.id","[PDF] unila.ac.id","http://digilib.unila.ac.id/76552/3/3.%20SKRIPSI%20TANPA%20BAB%20PEMBAHASAN.pdf"
"1700584929-467","https://scholar.google.com/scholar?hl=en&as_sdt=0%2C5&as_ylo=2023&as_yhi=2023&q=kecerdasan+buatan+untuk+deteksi+penyakit+hewan&btnG=","https://scholar.google.com/scholar?start=150&q=kecerdasan+buatan+untuk+deteksi+penyakit+hewan&hl=en&as_sdt=0,5&as_ylo=2023&as_yhi=2023","Pengantar Analisis Data Dengan R Studio","Hak Cipta sebagaimana dimaksud dalam Pasal 3 huruf a merupakan hak eksklusif yang 

terdiri atas hak moral dan hak ekonomi. Pembatasan Pelindungan Pasal 26 Ketentuan …","A Iskandar - 2023 - books.google.com","Pengantar Analisis Data Dengan R Studio","https://books.google.com/books?hl=en&lr=&id=c07HEAAAQBAJ&oi=fnd&pg=PA1&dq=kecerdasan+buatan+untuk+deteksi+penyakit+hewan&ots=Ig2cLqxeMq&sig=j-JKNS1EgSCc5YNBXrltSKvEhPE"
"1700584929-468","https://scholar.google.com/scholar?hl=en&as_sdt=0%2C5&as_ylo=2023&as_yhi=2023&q=kecerdasan+buatan+untuk+deteksi+penyakit+hewan&btnG=","https://scholar.google.com/scholar?start=150&q=kecerdasan+buatan+untuk+deteksi+penyakit+hewan&hl=en&as_sdt=0,5&as_ylo=2023&as_yhi=2023","SISTEM KOMPUTER DAN INFORMASI","… makanan untuk hewan herbivora, dan hewan tersebut berfungsi … atau kendaraan berbasis 

kecerdasan buatan adalah contoh … Menggunakan contoh basis data rumah sakit sebelumnya, …","CVG Lentera - researchgate.net","[PDF] researchgate.net","https://www.researchgate.net/profile/Ahmad-Muhariya/publication/373650954_SISTEM_KOMPUTER_DAN_INFORMASI/links/64f603b5827074313ffaa034/SISTEM-KOMPUTER-DAN-INFORMASI.pdf"
"1700584929-469","https://scholar.google.com/scholar?hl=en&as_sdt=0%2C5&as_ylo=2023&as_yhi=2023&q=kecerdasan+buatan+untuk+deteksi+penyakit+hewan&btnG=","https://scholar.google.com/scholar?start=150&q=kecerdasan+buatan+untuk+deteksi+penyakit+hewan&hl=en&as_sdt=0,5&as_ylo=2023&as_yhi=2023","","","RO RANI OKTAVIA - 2023 - Sekolah Tinggi Ilmu Kesehatan Bina …","",""
"1700584929-470","https://scholar.google.com/scholar?hl=en&as_sdt=0%2C5&as_ylo=2023&as_yhi=2023&q=kecerdasan+buatan+untuk+deteksi+penyakit+hewan&btnG=","https://scholar.google.com/scholar?start=150&q=kecerdasan+buatan+untuk+deteksi+penyakit+hewan&hl=en&as_sdt=0,5&as_ylo=2023&as_yhi=2023","Teknik Sipil","… terpisah, menghalangi pergerakan hewan liar dan mengganggu … satwa liar, dan menghambat 

migrasi dan reproduksi hewan. … navigasi, dan kecerdasan buatan untuk beroperasi tanpa …","B Witjaksana, DDJ Leihitu, M Al Dianty - 2023 - books.google.com","Teknik Sipil","https://books.google.com/books?hl=en&lr=&id=6UvhEAAAQBAJ&oi=fnd&pg=PA12&dq=kecerdasan+buatan+untuk+deteksi+penyakit+hewan&ots=TFGjRQkHQJ&sig=xvUuxS025y7Dam1fYHdFYvL-1U4"
"1700584929-471","https://scholar.google.com/scholar?hl=en&as_sdt=0%2C5&as_ylo=2023&as_yhi=2023&q=kecerdasan+buatan+untuk+deteksi+penyakit+hewan&btnG=","https://scholar.google.com/scholar?start=150&q=kecerdasan+buatan+untuk+deteksi+penyakit+hewan&hl=en&as_sdt=0,5&as_ylo=2023&as_yhi=2023","Filsafat Manusia: Mengungkap Hakikat, Misteri, dan Problem Kemanusiaan Kontemporer","… sebagai sebuah gejala dari proses penyembuhan atas penyakit … lebih besar dibandingkan 

dengan hewan. Lebih lanjut dicatat … : Kecerdasan buatan yang ditambahkan kepada suatu …","SD Maharani, FS Marunduri, R Febriani, S Hum, M Fils… - 2023 - books.google.com","Filsafat Manusia: Mengungkap Hakikat, Misteri, dan Problem Kemanusiaan Kontemporer","https://books.google.com/books?hl=en&lr=&id=n9riEAAAQBAJ&oi=fnd&pg=PR1&dq=kecerdasan+buatan+untuk+deteksi+penyakit+hewan&ots=WzoMZdjXPG&sig=zi3by2mQcX4y1yKWYabMc_U5qfA"
"1700584929-472","https://scholar.google.com/scholar?hl=en&as_sdt=0%2C5&as_ylo=2023&as_yhi=2023&q=kecerdasan+buatan+untuk+deteksi+penyakit+hewan&btnG=","https://scholar.google.com/scholar?start=150&q=kecerdasan+buatan+untuk+deteksi+penyakit+hewan&hl=en&as_sdt=0,5&as_ylo=2023&as_yhi=2023","PROTOTYPE ALAT PENGUKUR BERAT BADAN BERBASIS COMPUTER VISION DENGAN MENGGUNAKAN REGRESI LINIER","… citra digital dari kamera dengan kecerdasan buatan yang umumnya menggunakan pendekatan 

… Computer vision juga telah diterapkan pada pengukuran (prediksi) berat badan hewan …","R FIRMANSYAH - 2023 - repository.unissula.ac.id","[PDF] unissula.ac.id","http://repository.unissula.ac.id/29651/1/Teknik%20Informatika_32601700022_fullpdf.pdf"
