web-scraper-order,web-scraper-start-url,halaman_pencarian,judul,excerpt,author,link_pencarian,link_pencarian-href
"1700584869-271","https://scholar.google.com/scholar?hl=en&as_sdt=0%2C5&as_ylo=2023&as_yhi=2023&q=kecerdasan+buatan+untuk+deteksi+penyakit+hewan&btnG=","https://scholar.google.com/scholar?start=64&q=kecerdasan+buatan+untuk+deteksi+penyakit+hewan&hl=en&as_sdt=0,5&as_ylo=2023&as_yhi=2023","IMPLEMENTASI BIG DATA DAN KECERDASAN ARTIFISIAL UNTUK STATISTIK OFISIAL","… gejala, seperti radang paru-paru, demam, kesulitan bernapas, dan infeksi paru-paru [1]. Virus 

ini diduga berasal dari hewan yang … Kecerdasan buatan bekerja menggunakan algoritma …","I Machdi, AR MNSPM, AW Wijayanto, AP Putra… - ARTIFICIAL - researchgate.net","[PDF] researchgate.net","https://www.researchgate.net/profile/Suryadiputra-Liawatimena/publication/371167164_Use_Cases_Artificial_Intelligence_Indonesia/links/64771bdea25e543829e23719/Use-Cases-Artificial-Intelligence-Indonesia.pdf#page=64"
"1700584869-272","https://scholar.google.com/scholar?hl=en&as_sdt=0%2C5&as_ylo=2023&as_yhi=2023&q=kecerdasan+buatan+untuk+deteksi+penyakit+hewan&btnG=","https://scholar.google.com/scholar?start=64&q=kecerdasan+buatan+untuk+deteksi+penyakit+hewan&hl=en&as_sdt=0,5&as_ylo=2023&as_yhi=2023","METODE DAN PENERAPAN SISTEM PAKAR","… dalam sistem berbasis pengetahuan, kecerdasan buatan dan aplikasi terkait lainnya. … 

berbagai bidang yang telah memanfaatkan kecerdasan buatan untuk memecahkan masalah yang …","H Sirait, R Mayasari, N Heryana, JS Pasaribu… - 2023 - books.google.com","METODE DAN PENERAPAN SISTEM PAKAR","https://books.google.com/books?hl=en&lr=&id=XbDNEAAAQBAJ&oi=fnd&pg=PA121&dq=kecerdasan+buatan+untuk+deteksi+penyakit+hewan&ots=Xfpvd8K7iv&sig=pZDCuqRT9HWglGoQEqvu_GIzopI"
"1700584869-273","https://scholar.google.com/scholar?hl=en&as_sdt=0%2C5&as_ylo=2023&as_yhi=2023&q=kecerdasan+buatan+untuk+deteksi+penyakit+hewan&btnG=","https://scholar.google.com/scholar?start=64&q=kecerdasan+buatan+untuk+deteksi+penyakit+hewan&hl=en&as_sdt=0,5&as_ylo=2023&as_yhi=2023","Cyborgs dan perempuan menurut pandangan Posthumanisme Donna J. Haraway","… Dan ini merubah pemahaman bahwa penyakit dan pandemi … mengeksplorasi terhadap 

lingkungan, hewan dan manusia. Ini … posthumanisme setuju dengan kecerdasan buatan, mesin …","BD Putra, R Hambali - Jurnal Penelitian Ilmu Ushuluddin, 2023 - etheses.uinsgd.ac.id","[PDF] uinsgd.ac.id","https://etheses.uinsgd.ac.id/65221/3/document%20%283%29.pdf"
"1700584869-274","https://scholar.google.com/scholar?hl=en&as_sdt=0%2C5&as_ylo=2023&as_yhi=2023&q=kecerdasan+buatan+untuk+deteksi+penyakit+hewan&btnG=","https://scholar.google.com/scholar?start=64&q=kecerdasan+buatan+untuk+deteksi+penyakit+hewan&hl=en&as_sdt=0,5&as_ylo=2023&as_yhi=2023","Enzibiotik: Memberi energi antibiotik sebagai senjata yang efektif dalam memerangi infeksi","… bahwa hewan akan terkena penyakit. Hal ini menyebabkan transfer strain bakteri 

resisten ke dalam makanan yang dikonsumsi orang, yang dapat menyebabkan penularan …","F Sabry - 2023 - books.google.com","Enzibiotik: Memberi energi antibiotik sebagai senjata yang efektif dalam memerangi infeksi","https://books.google.com/books?hl=en&lr=&id=9QqvEAAAQBAJ&oi=fnd&pg=PT353&dq=kecerdasan+buatan+untuk+deteksi+penyakit+hewan&ots=ebhrSBpEnd&sig=8t7v_dPSu5MURjo0qXc4EDCFfCA"
"1700584872-275","https://scholar.google.com/scholar?hl=en&as_sdt=0%2C5&as_ylo=2023&as_yhi=2023&q=kecerdasan+buatan+untuk+deteksi+penyakit+hewan&btnG=","https://scholar.google.com/scholar?start=134&q=kecerdasan+buatan+untuk+deteksi+penyakit+hewan&hl=en&as_sdt=0,5&as_ylo=2023&as_yhi=2023","Transformasi Digital","… inovasi produk dan layanan Transformasi digital dapat membantu bisnis mengembangkan 

produk dan layanan baru dengan memanfaatkan teknologi baru seperti kecerdasan buatan (…","MA Chatra P, AW Pasaribu, NJA Novel, AR Thaha… - 2023 - dspace.uc.ac.id","[PDF] uc.ac.id","https://dspace.uc.ac.id/bitstream/handle/123456789/6885/Plagiarism6885.pdf?sequence=5"
"1700584872-276","https://scholar.google.com/scholar?hl=en&as_sdt=0%2C5&as_ylo=2023&as_yhi=2023&q=kecerdasan+buatan+untuk+deteksi+penyakit+hewan&btnG=","https://scholar.google.com/scholar?start=134&q=kecerdasan+buatan+untuk+deteksi+penyakit+hewan&hl=en&as_sdt=0,5&as_ylo=2023&as_yhi=2023","Pedoman Bangunan Cerdas Nusantara","… bangunan dengan kecerdasan dan koneksi, mulai dari kecerdasan buatan dan machine … 

Perlindungan Bahaya Hewan adalah teknologi yang mampu mendeteksi kehadiran hewan …","OIK Nusantara - ikn.go.id","[PDF] ikn.go.id","https://www.ikn.go.id/storage/pedoman-bangunan-cerdas-nusantara.pdf"
"1700584872-277","https://scholar.google.com/scholar?hl=en&as_sdt=0%2C5&as_ylo=2023&as_yhi=2023&q=kecerdasan+buatan+untuk+deteksi+penyakit+hewan&btnG=","https://scholar.google.com/scholar?start=134&q=kecerdasan+buatan+untuk+deteksi+penyakit+hewan&hl=en&as_sdt=0,5&as_ylo=2023&as_yhi=2023","TINJAUAN NARATIF MENGENAI TRANSFORMASI BISNIS MELALUI KOMPUTASI AWAN","… Tren masa depan seperti komputasi awan hibrida dan kecerdasan buatan dalam 

komputasi awan menunjukkan potensi inovasi yang lebih lanjut. Dengan pemahaman yang …","FY Sena - Jurnal Ilmu Data, 2023 - ilmudata.org","[PDF] ilmudata.org","http://ilmudata.org/index.php/ilmudata/article/download/314/300"
"1700584872-278","https://scholar.google.com/scholar?hl=en&as_sdt=0%2C5&as_ylo=2023&as_yhi=2023&q=kecerdasan+buatan+untuk+deteksi+penyakit+hewan&btnG=","https://scholar.google.com/scholar?start=134&q=kecerdasan+buatan+untuk+deteksi+penyakit+hewan&hl=en&as_sdt=0,5&as_ylo=2023&as_yhi=2023","Strategi Demonstrasi Guru Dalam Mengembangkan Kecerdasan Naturalis Anak Usia Dini di TA Al-Manaar Ngabar Siman Ponorogo","… kecerdasan naturalis, seperti berkebun, merawat hewan, … 4) Menyayangi hewan, dengan 

cara mempelihara hewan … makan hewan dan membuat tempat tinggal hewan tersebut. …","CA Fharadena - 2023 - etheses.iainponorogo.ac.id","[PDF] iainponorogo.ac.id","http://etheses.iainponorogo.ac.id/24729/1/STRATEGI%20DEMONSTRASI%20GURU%20DALAM%20MENGEMBANGKAN%20KECERDASAN%20NATURALIS%20ANAK%20USIA%20DINI%20DI%20TA%20AL-MANAAR%20AL-ISLAMIYAH%20NGABAR%20SIMAN%20PONOROGO-chyeneza%20205190044.pdf"
"1700584872-279","https://scholar.google.com/scholar?hl=en&as_sdt=0%2C5&as_ylo=2023&as_yhi=2023&q=kecerdasan+buatan+untuk+deteksi+penyakit+hewan&btnG=","https://scholar.google.com/scholar?start=134&q=kecerdasan+buatan+untuk+deteksi+penyakit+hewan&hl=en&as_sdt=0,5&as_ylo=2023&as_yhi=2023","MACHINE LEARNING dengan R Teori & Praktikum","Machine Learning (ML) merupakan cabang ilmu di era Data Science dan Big Data yang 

akhir-akhir ini populer. Dengan segala manfaat yang diberikan oleh ML, banyak aspek dalam …","JA Nursiyono - 2023 - books.google.com","MACHINE LEARNING dengan R Teori & Praktikum","https://books.google.com/books?hl=en&lr=&id=4T-xEAAAQBAJ&oi=fnd&pg=PA79&dq=kecerdasan+buatan+untuk+deteksi+penyakit+hewan&ots=khzUEIvktu&sig=1iH_ItO0fnfr6Ye5Kwgnkl-IB5Y"
"1700584872-280","https://scholar.google.com/scholar?hl=en&as_sdt=0%2C5&as_ylo=2023&as_yhi=2023&q=kecerdasan+buatan+untuk+deteksi+penyakit+hewan&btnG=","https://scholar.google.com/scholar?start=134&q=kecerdasan+buatan+untuk+deteksi+penyakit+hewan&hl=en&as_sdt=0,5&as_ylo=2023&as_yhi=2023","… PUBLIKASI ETHESIS DENGAN TTD ASLI BUKAN SCAN, UPLOAD ULANG).. Strategi Demonstrasi Guru Dalam Mengembangkan Kecerdasan Naturalis Anak Usia …","… kecerdasan naturalis, seperti berkebun, merawat hewan, … 4) Menyayangi hewan, dengan 

cara mempelihara hewan … makan hewan dan membuat tempat tinggal hewan tersebut. …","C Fharadena - 2023 - etheses.iainponorogo.ac.id","[PDF] iainponorogo.ac.id","http://etheses.iainponorogo.ac.id/24479/1/STRATEGI%20DEMONSTRASI%20GURU%20DALAM%20MENGEMBANGKAN%20KECERDASAN%20NATURALIS%20ANAK%20USIA%20DINI%20205190044.pdf"
"1700584872-281","https://scholar.google.com/scholar?hl=en&as_sdt=0%2C5&as_ylo=2023&as_yhi=2023&q=kecerdasan+buatan+untuk+deteksi+penyakit+hewan&btnG=","https://scholar.google.com/scholar?start=134&q=kecerdasan+buatan+untuk+deteksi+penyakit+hewan&hl=en&as_sdt=0,5&as_ylo=2023&as_yhi=2023","IDENTIFIKASI GANGGUAN KUALITAS DAYA MENGGUNAKAN S-TRANSFORM DAN RULE BASE EXPERT SYSTEM","… salah satu bidang aplikasi dari kecerdasan buatan yang paling banyak digunakan, hal ini … 

yang relative lebih murah dibandingkan metode kecerdasan buatan lainnya. Dalam buku ini …","A Wenda - repository.uin-suska.ac.id","[PDF] uin-suska.ac.id","http://repository.uin-suska.ac.id/69042/1/Buku_PQ_1_Lengkap.pdf"
"1700584872-282","https://scholar.google.com/scholar?hl=en&as_sdt=0%2C5&as_ylo=2023&as_yhi=2023&q=kecerdasan+buatan+untuk+deteksi+penyakit+hewan&btnG=","https://scholar.google.com/scholar?start=134&q=kecerdasan+buatan+untuk+deteksi+penyakit+hewan&hl=en&as_sdt=0,5&as_ylo=2023&as_yhi=2023","RANCANG BANGUN SISTEM MONITORING KLIMATOLOGI MIKRO WILAYAH KONSERVASI MANGROVE PETENGORAN BERBASIS INTERNET OF THINGS","… wabah penyakit seperti demam berdarah, kulit penyakit, batuk … Kerusakan ini tidak hanya 

berdampak pada hewan tetapi … algoritma dari kecerdasan buatan sehingga dari yang semula …","AP Fajri - 2023 - digilib.unila.ac.id","[PDF] unila.ac.id","http://digilib.unila.ac.id/69373/2/tanpa%20pembahasan.pdf"
"1700584872-283","https://scholar.google.com/scholar?hl=en&as_sdt=0%2C5&as_ylo=2023&as_yhi=2023&q=kecerdasan+buatan+untuk+deteksi+penyakit+hewan&btnG=","https://scholar.google.com/scholar?start=134&q=kecerdasan+buatan+untuk+deteksi+penyakit+hewan&hl=en&as_sdt=0,5&as_ylo=2023&as_yhi=2023","Analisa Sentimen Informasi Hoaks Pasca Pandemi Covid-19 dengan Text Mining","… Padahal, tidak hanya pasien atau orang sakit dan keluarganya yang distigmatisasi, perawat 

… penggunaan teknik statistik, matematika, kecerdasan buatan, dan machine learning untuk …","AR Purnajaya, Y Pernando - Journal of Computer System …, 2023 - ejurnal.seminar-id.com","[PDF] seminar-id.com","http://ejurnal.seminar-id.com/index.php/josyc/article/download/3358/1976"
"1700584872-284","https://scholar.google.com/scholar?hl=en&as_sdt=0%2C5&as_ylo=2023&as_yhi=2023&q=kecerdasan+buatan+untuk+deteksi+penyakit+hewan&btnG=","https://scholar.google.com/scholar?start=134&q=kecerdasan+buatan+untuk+deteksi+penyakit+hewan&hl=en&as_sdt=0,5&as_ylo=2023&as_yhi=2023","BUKU AJAR PENGANTAR KESEHATAN MASYARAKAT (DALAM PROMOSI KESEHATAN) JILID 2","… banyak penyakit infeksi tersebut juga disertai dengan penyakit … kaya zat besi terutama 

makanan asal hewan (daging). AGB … dengan fungsi mental dan kecerdasan, sehingga ekspresi …","NF Hayati, NA Nadira - 2023 - books.google.com","BUKU AJAR PENGANTAR KESEHATAN MASYARAKAT (DALAM PROMOSI KESEHATAN) JILID 2","https://books.google.com/books?hl=en&lr=&id=lSjeEAAAQBAJ&oi=fnd&pg=PA1&dq=kecerdasan+buatan+untuk+deteksi+penyakit+hewan&ots=nubP62XDLJ&sig=PLi3KlsfaOgYbJMTuPq2qLWlJ3w"
"1700584875-285","https://scholar.google.com/scholar?hl=en&as_sdt=0%2C5&as_ylo=2023&as_yhi=2023&q=kecerdasan+buatan+untuk+deteksi+penyakit+hewan&btnG=","https://scholar.google.com/scholar?start=124&q=kecerdasan+buatan+untuk+deteksi+penyakit+hewan&hl=en&as_sdt=0,5&as_ylo=2023&as_yhi=2023","Voice Cloning: Membuat Sendiri Suara Artifisial Menggunakan Metode Sequence to Sequence Speech Synthesis","… apakah hewan yang ada digambar merupakan seekor anjing … yang membuat kucing dan 

anjing terlihat berbeda tanpa kita … menciptakan kecerdasan buatan yang lebih manusiawi. …","D Majesty, RM Awangga, MN Fauzan - 2023 - books.google.com","Voice Cloning: Membuat Sendiri Suara Artifisial Menggunakan Metode Sequence to Sequence Speech Synthesis","https://books.google.com/books?hl=en&lr=&id=RiKlEAAAQBAJ&oi=fnd&pg=PR13&dq=kecerdasan+buatan+untuk+deteksi+penyakit+hewan&ots=VBV77oGbmh&sig=9JGIuSV5J4SAzPqrM0bTd-V8NTI"
"1700584875-286","https://scholar.google.com/scholar?hl=en&as_sdt=0%2C5&as_ylo=2023&as_yhi=2023&q=kecerdasan+buatan+untuk+deteksi+penyakit+hewan&btnG=","https://scholar.google.com/scholar?start=124&q=kecerdasan+buatan+untuk+deteksi+penyakit+hewan&hl=en&as_sdt=0,5&as_ylo=2023&as_yhi=2023","Ahmad Jurnaidi Wahidin Gusti Eka Yuliastuti Elisawati Rima Rizqi Wijayanti Abdurrasyid","… Pembelajaran mesih tercipta dari pengembangan kecerdasan buatan. Bahkan pada awal 

kecerdasan buatan lahir sebagai ilmu baru dalam bidang akademis, banyak peneliti yang …","AA Permana, S Wahyuddin, LW Santoso… - repository.bsi.ac.id","[PDF] bsi.ac.id","https://repository.bsi.ac.id/repo/files/364253/download/Buku---Machine-Learning.pdf"
"1700584875-287","https://scholar.google.com/scholar?hl=en&as_sdt=0%2C5&as_ylo=2023&as_yhi=2023&q=kecerdasan+buatan+untuk+deteksi+penyakit+hewan&btnG=","https://scholar.google.com/scholar?start=124&q=kecerdasan+buatan+untuk+deteksi+penyakit+hewan&hl=en&as_sdt=0,5&as_ylo=2023&as_yhi=2023","PENA PERSADA","… yang membahas penerapan grafika komputer dalam kecerdasan buatan, pertanian, iklan, … 

rusak (pada savana user menemukan hewan yang melakukan moonwalk), hingga yang lebih …","TPG Komputer, PM Kini - info.trilogi.ac.id","[PDF] trilogi.ac.id","https://info.trilogi.ac.id/repository/assets/uploads/AGB/0b838-tren-perkembangan-grafika-komputer-pada-masa-kini-versi-e-book_compressed-1-.pdf"
"1700584875-288","https://scholar.google.com/scholar?hl=en&as_sdt=0%2C5&as_ylo=2023&as_yhi=2023&q=kecerdasan+buatan+untuk+deteksi+penyakit+hewan&btnG=","https://scholar.google.com/scholar?start=124&q=kecerdasan+buatan+untuk+deteksi+penyakit+hewan&hl=en&as_sdt=0,5&as_ylo=2023&as_yhi=2023","Klaster Riset","… perkembangan dalam bidang kecerdasan buatan telah memicu … Kita mengabaikan fakta 

bahwa hewan dapat hidup dan … Bayangkan kalau kita tidak dapat merasakan sakit saat …","P Satwiko, S Felasari, M Cininta - researchgate.net","[PDF] researchgate.net","https://www.researchgate.net/profile/Prasasto-Satwiko/publication/371506002_Seri_Pustaka_Neuroarsitektur_Klaster_Riset_Artificially_Intelligent_Neuro-Architecture_AINA/links/6487dc1879a72237652c18d3/Seri-Pustaka-Neuroarsitektur-Klaster-Riset-Artificially-Intelligent-Neuro-Architecture-AINA.pdf"
"1700584875-289","https://scholar.google.com/scholar?hl=en&as_sdt=0%2C5&as_ylo=2023&as_yhi=2023&q=kecerdasan+buatan+untuk+deteksi+penyakit+hewan&btnG=","https://scholar.google.com/scholar?start=124&q=kecerdasan+buatan+untuk+deteksi+penyakit+hewan&hl=en&as_sdt=0,5&as_ylo=2023&as_yhi=2023","APLIKASI SISTEM PAKAR PENURUNAN DBD DALAM PERSPEKTIF ECONOMIC LOSS SEBAGAI UPAYA PENCAPAIAN UNIVERSAL COVERAGE DI ERA …","… Buku ini membahas tentang kerugian ekonomi yang disebabkan oleh penyakit Demam 

Berdarah Dengue (DBD). Buku ini penulis kontribusikan untuk dunia kesehatan khusunya bagi …","WG Putro, TO Ratnaningtyas, S KM - 2023 - books.google.com","APLIKASI SISTEM PAKAR PENURUNAN DBD DALAM PERSPEKTIF ECONOMIC LOSS SEBAGAI UPAYA PENCAPAIAN UNIVERSAL COVERAGE DI ERA …","https://books.google.com/books?hl=en&lr=&id=v2DjEAAAQBAJ&oi=fnd&pg=PA11&dq=kecerdasan+buatan+untuk+deteksi+penyakit+hewan&ots=67z3HCi3jl&sig=v_VYUQsomXTfQhfBu3k34uq4Vt8"
"1700584875-290","https://scholar.google.com/scholar?hl=en&as_sdt=0%2C5&as_ylo=2023&as_yhi=2023&q=kecerdasan+buatan+untuk+deteksi+penyakit+hewan&btnG=","https://scholar.google.com/scholar?start=124&q=kecerdasan+buatan+untuk+deteksi+penyakit+hewan&hl=en&as_sdt=0,5&as_ylo=2023&as_yhi=2023","Machine Learning","… Pembelajaran mesih tercipta dari pengembangan kecerdasan buatan. Bahkan pada awal 

kecerdasan buatan lahir sebagai ilmu baru dalam bidang akademis, banyak peneliti yang …","AA Permana, S Wahyuddin, LW Santoso… - 2023 - books.google.com","Machine Learning","https://books.google.com/books?hl=en&lr=&id=1_muEAAAQBAJ&oi=fnd&pg=PA1&dq=kecerdasan+buatan+untuk+deteksi+penyakit+hewan&ots=RGjQW9nUkY&sig=eiyrxNk0070uZo2kBbIeNpnC5s0"
"1700584875-291","https://scholar.google.com/scholar?hl=en&as_sdt=0%2C5&as_ylo=2023&as_yhi=2023&q=kecerdasan+buatan+untuk+deteksi+penyakit+hewan&btnG=","https://scholar.google.com/scholar?start=124&q=kecerdasan+buatan+untuk+deteksi+penyakit+hewan&hl=en&as_sdt=0,5&as_ylo=2023&as_yhi=2023","Menelisik Sikap Pemerintah Indonesia Dalam Menghadapi Kelangkaan Alat Pelindung Diri Ditengah Wabah Pandemi Coronavirus Disease (Ditinjau Dari Undang …","… menyebabkan penyakit yang menimbulkan gejala … hewan liar seperti kelalawar serta 

menghindari kontak secara langsung dengan orang yang menunjukkan adanya gejala penyakit …","ME Gondokesumo, N Amir - Jurnal Hukum & Pembangunan …, 2023 - repository.ubaya.ac.id","[PDF] ubaya.ac.id","http://repository.ubaya.ac.id/45157/1/Marisca%20Evalina%20Gondokesumo_MENELISIK%20SIKAP%20PEMERINTAH%20INDONESIA.pdf"
"1700584875-292","https://scholar.google.com/scholar?hl=en&as_sdt=0%2C5&as_ylo=2023&as_yhi=2023&q=kecerdasan+buatan+untuk+deteksi+penyakit+hewan&btnG=","https://scholar.google.com/scholar?start=124&q=kecerdasan+buatan+untuk+deteksi+penyakit+hewan&hl=en&as_sdt=0,5&as_ylo=2023&as_yhi=2023","Sensor Nano: Mengembangkan jaringan sensor nano cerdas untuk menyalakan kimiawi otak, dan mendeteksi dini kanker","… Penggunaan nanosensor dalam pengobatan diagnostik memiliki banyak janji karena akan 

memungkinkan untuk mendeteksi penyakit pada tahap awal tanpa harus bergantung pada …","F Sabry - 2023 - books.google.com","Sensor Nano: Mengembangkan jaringan sensor nano cerdas untuk menyalakan kimiawi otak, dan mendeteksi dini kanker","https://books.google.com/books?hl=en&lr=&id=tt6sEAAAQBAJ&oi=fnd&pg=PT426&dq=kecerdasan+buatan+untuk+deteksi+penyakit+hewan&ots=gjjWX5MBEq&sig=OnQz9FURYMwS1LfbLi4X07kJfFE"
"1700584875-293","https://scholar.google.com/scholar?hl=en&as_sdt=0%2C5&as_ylo=2023&as_yhi=2023&q=kecerdasan+buatan+untuk+deteksi+penyakit+hewan&btnG=","https://scholar.google.com/scholar?start=124&q=kecerdasan+buatan+untuk+deteksi+penyakit+hewan&hl=en&as_sdt=0,5&as_ylo=2023&as_yhi=2023","PREDIKSI KANDIDAT SENYAWA HASIL ISOLASI DARI KULIT BATANG Sesbania grandiflora (L.) SEBAGAI ANTI-INFLAMMASI COVID-19 MENGGUNAKAN …","… kecerdasan buatan… penyakit saluran pernapasan pada hewan maupun manusia. Beberapa 

jenis dari coronavirus dapat menyebabkan infeksi pada saluran pernapasan dengan gejala …","MP Havier - 2023 - digilib.unila.ac.id","[PDF] unila.ac.id","http://digilib.unila.ac.id/76525/3/SKRIPSI%20TANPA%20BAB%20PEMBAHASAN.pdf"
"1700584875-294","https://scholar.google.com/scholar?hl=en&as_sdt=0%2C5&as_ylo=2023&as_yhi=2023&q=kecerdasan+buatan+untuk+deteksi+penyakit+hewan&btnG=","https://scholar.google.com/scholar?start=124&q=kecerdasan+buatan+untuk+deteksi+penyakit+hewan&hl=en&as_sdt=0,5&as_ylo=2023&as_yhi=2023","TRANSFORMASI DIGITAL","… inovasi produk dan layanan Transformasi digital dapat membantu bisnis mengembangkan 

produk dan layanan baru dengan memanfaatkan teknologi baru seperti kecerdasan buatan (…","E Erwin, AW Pasaribu, NJA Novel, AR Thaha… - 2023 - books.google.com","TRANSFORMASI DIGITAL","https://books.google.com/books?hl=en&lr=&id=SXTCEAAAQBAJ&oi=fnd&pg=PA30&dq=kecerdasan+buatan+untuk+deteksi+penyakit+hewan&ots=bZyRvTbCXK&sig=FcMfCzgSMLF7N5MXrT8L7TEWg2I"
"1700584878-295","https://scholar.google.com/scholar?hl=en&as_sdt=0%2C5&as_ylo=2023&as_yhi=2023&q=kecerdasan+buatan+untuk+deteksi+penyakit+hewan&btnG=","https://scholar.google.com/scholar?start=114&q=kecerdasan+buatan+untuk+deteksi+penyakit+hewan&hl=en&as_sdt=0,5&as_ylo=2023&as_yhi=2023","PREDIKSI KADAR NITROGEN TOTAL PADA LIMBAH CAIR PABRIK KELAPA SAWIT MENGGUNAKAN METODE MULTISENSOR","… untuk mengetahui atau mendeteksi gejala perubahan-perubahan … kecerdasan buatan 

yang memiliki fungsi sebagai sistem pengolah informasi dan mengadopsi sifat dari kecerdasan …","I Santoso - 2023 - digilib.unila.ac.id","[PDF] unila.ac.id","http://digilib.unila.ac.id/70742/3/SKRIPSI%20FULL%20TANPA%20BAB%20PEMBAHASAN.pdf"
"1700584878-296","https://scholar.google.com/scholar?hl=en&as_sdt=0%2C5&as_ylo=2023&as_yhi=2023&q=kecerdasan+buatan+untuk+deteksi+penyakit+hewan&btnG=","https://scholar.google.com/scholar?start=114&q=kecerdasan+buatan+untuk+deteksi+penyakit+hewan&hl=en&as_sdt=0,5&as_ylo=2023&as_yhi=2023","Optimisasi Sistem Pendinginan dengan Teknik Mesin Terbaru","… • Penggunaan kecerdasan buatan dalam analisis data: Penerapan algoritma 

kecerdasan buatan untuk menganalisis dan menginterpretasikan data operasional mesin, …","DIO RAHMAWAN - Laporan Kerja Praktek Mahasiswa Teknik, 2023 - coursework.uma.ac.id","[PDF] uma.ac.id","http://coursework.uma.ac.id/index.php/teknik/article/download/310/224"
"1700584878-297","https://scholar.google.com/scholar?hl=en&as_sdt=0%2C5&as_ylo=2023&as_yhi=2023&q=kecerdasan+buatan+untuk+deteksi+penyakit+hewan&btnG=","https://scholar.google.com/scholar?start=114&q=kecerdasan+buatan+untuk+deteksi+penyakit+hewan&hl=en&as_sdt=0,5&as_ylo=2023&as_yhi=2023","PROGRAM SOCIETY 5.0 SEBAGAI STRATEGI JEPANG DALAM MENGHADAPI MASALAH KURANGNYA TENAGA KERJA AKIBAT AGEING SOCIETY","… di lingkungan kerja dan terserang penyakit. Keempat, karena … kecerdasan buatan atau 

artificial intelligent (AI).… tentang tanah, tanaman, dan hewan, melalui sensor tersebut yang …","G Trian Habib - 2023 - eprints.unram.ac.id","[PDF] unram.ac.id","http://eprints.unram.ac.id/41525/2/Trian%20Habib%20Goffary_L1A017107_JURNAL.pdf"
"1700584878-298","https://scholar.google.com/scholar?hl=en&as_sdt=0%2C5&as_ylo=2023&as_yhi=2023&q=kecerdasan+buatan+untuk+deteksi+penyakit+hewan&btnG=","https://scholar.google.com/scholar?start=114&q=kecerdasan+buatan+untuk+deteksi+penyakit+hewan&hl=en&as_sdt=0,5&as_ylo=2023&as_yhi=2023","Expert System Mendiagnosa Tingkat Depresi Siswa Menggunakan Metode Certainly Factor","… menjawab pertanyaan dari data gejala-gejala yang menjadi penyebab depresi … kecerdasan 

buatan muncul sebagai cabang ilmu yang mencoba mempelajari dan meniru kecerdasan …","N Yulianti - 2023 - repository.upbatam.ac.id","[PDF] upbatam.ac.id","http://repository.upbatam.ac.id/5843/1/cover%20s.d%20bab%20III.pdf"
"1700584878-299","https://scholar.google.com/scholar?hl=en&as_sdt=0%2C5&as_ylo=2023&as_yhi=2023&q=kecerdasan+buatan+untuk+deteksi+penyakit+hewan&btnG=","https://scholar.google.com/scholar?start=114&q=kecerdasan+buatan+untuk+deteksi+penyakit+hewan&hl=en&as_sdt=0,5&as_ylo=2023&as_yhi=2023","SISTEM PAKAR DIAGNOSIS AWAL PENYAKIT MALARIA TERHADAP MANUSIA MENGGUNAKAN METODE DEMSPTER SHAFER THEORY","… Penyakit malaria merupakan suatu penyakit infeksi yang … Penyakit malaria masih merupakan 

masalah kesehatan masyarakat di Indonesia sampai saat ini. Angka kesakitan penyakit ini …","MN Aliandu, Y Rada… - Indonesian Journal of …, 2023 - ijtl.nindikayla.com","[PDF] nindikayla.com","http://ijtl.nindikayla.com/index.php/home/article/download/47/44"
"1700584878-300","https://scholar.google.com/scholar?hl=en&as_sdt=0%2C5&as_ylo=2023&as_yhi=2023&q=kecerdasan+buatan+untuk+deteksi+penyakit+hewan&btnG=","https://scholar.google.com/scholar?start=114&q=kecerdasan+buatan+untuk+deteksi+penyakit+hewan&hl=en&as_sdt=0,5&as_ylo=2023&as_yhi=2023","Nanorobotik: Pengiriman obat cerdas menggunakan sistem robot mikro dan nano biohybrid","… , tidak akan pernah terdengar seperti cacar dan penyakit kudis di dunia modern kita. … 

penggunaan nanoteknologi molekuler oleh kecerdasan umum buatan antagonis, mungkin memiliki …","F Sabry - 2023 - books.google.com","Nanorobotik: Pengiriman obat cerdas menggunakan sistem robot mikro dan nano biohybrid","https://books.google.com/books?hl=en&lr=&id=NgKoEAAAQBAJ&oi=fnd&pg=PT455&dq=kecerdasan+buatan+untuk+deteksi+penyakit+hewan&ots=oigDyIIZLl&sig=Cn7Wx7vbE05vR2r3c4qmB2kJ2_A"
"1700584878-301","https://scholar.google.com/scholar?hl=en&as_sdt=0%2C5&as_ylo=2023&as_yhi=2023&q=kecerdasan+buatan+untuk+deteksi+penyakit+hewan&btnG=","https://scholar.google.com/scholar?start=114&q=kecerdasan+buatan+untuk+deteksi+penyakit+hewan&hl=en&as_sdt=0,5&as_ylo=2023&as_yhi=2023","MODEL JARINGAN PEMANGKU KEPENTINGAN EKOSISTEM AGILE","… ekor per minggu harus memiliki Rumah Potong Hewan Unggas (RPHU) dengan fasilitas … 

Teknologi baru seperti otomatisasi, kecerdasan buatan, analitik data, dan komputasi awan …","PR Ali, S Suprihatin, NS Indrasti - Jurnal Teknologi Industri …, 2023 - journal.ipb.ac.id","[PDF] ipb.ac.id","https://journal.ipb.ac.id/index.php/jurnaltin/article/download/48852/25999"
"1700584878-302","https://scholar.google.com/scholar?hl=en&as_sdt=0%2C5&as_ylo=2023&as_yhi=2023&q=kecerdasan+buatan+untuk+deteksi+penyakit+hewan&btnG=","https://scholar.google.com/scholar?start=114&q=kecerdasan+buatan+untuk+deteksi+penyakit+hewan&hl=en&as_sdt=0,5&as_ylo=2023&as_yhi=2023","KLASIFIKASI JENIS JERAWAT WAJAH MENGGUNAKAN ARSITEKTUR INCEPTION V3","… Dalam perkembangan teknologi saat ini, terutama di bidang kecerdasan buatan dan … 

Arsitektur CNN terinspirasi oleh cara kerja visual manusia dan sistem pengindraan visual hewan. …","SA Amania - 2023 - repository.unissula.ac.id","[PDF] unissula.ac.id","http://repository.unissula.ac.id/32041/1/Teknik%20Informatika_32601900029_fullpdf.pdf"
"1700584878-303","https://scholar.google.com/scholar?hl=en&as_sdt=0%2C5&as_ylo=2023&as_yhi=2023&q=kecerdasan+buatan+untuk+deteksi+penyakit+hewan&btnG=","https://scholar.google.com/scholar?start=114&q=kecerdasan+buatan+untuk+deteksi+penyakit+hewan&hl=en&as_sdt=0,5&as_ylo=2023&as_yhi=2023","Buku Ajar Pengantar Deep Learning dalam Pemrosesan Citra","… sama untuk semua orang dengan gejala atau kualifikasi serupa. Untuk … atau kecerdasan 

buatan merupakan simulasi dari kecerdasan … Misalnya, jika membuat dataset hewan, kita dapat …","RR Putra, IGT Isa, ABJ Malyan - 2023 - books.google.com","Buku Ajar Pengantar Deep Learning dalam Pemrosesan Citra","https://books.google.com/books?hl=en&lr=&id=F1a6EAAAQBAJ&oi=fnd&pg=PR1&dq=kecerdasan+buatan+untuk+deteksi+penyakit+hewan&ots=Yf6eAXDL9Y&sig=1ntkOiWZK4zfCc06B1mhZMDpRxw"
